HOUR,DATE_MILADI,DATE_SHAMSI,POWER,CODE,UNIT_NO,DAMA,ROTOOBAT,12209_G13,12210_G13,ebraz,importance_factor,year,month,dayofweek,DECLARED
24,12/31/2023 0:00,1402/10/10,30,SO,3,13.5,58.5,9.35,7.95,0,1.5,2024,1,0,0
13,12/31/2023 13:00,1402/10/10,55,PO,3,14.5,54.5,8.9,7.8,0,1.5,2024,1,0,0
14,12/31/2023 14:00,1402/10/10,67.5,PO,3,14.5,57,8.9,7.8,0,1.5,2024,1,0,0
15,12/31/2023 15:00,1402/10/10,67.5,PO,3,13.5,57.5,8.9,7.8,0,1.5,2024,1,0,0
16,12/31/2023 16:00,1402/10/10,68,PO,3,13,63,8.9,7.8,0,1.5,2024,1,0,0
17,12/31/2023 17:00,1402/10/10,133,SO,3,11.5,73,8.9,7.8,0,1.5,2024,1,0,0
18,12/31/2023 18:00,1402/10/10,133,SO,3,10.5,79,8.9,7.8,0,2.5,2024,1,0,0
19,12/31/2023 19:00,1402/10/10,130.5,SO,3,9.5,81.5,9,7.8,0,2.5,2024,1,0,0
20,12/31/2023 20:00,1402/10/10,88.5,SO,3,10.5,76.5,9,7.8,0,2.5,2024,1,0,0
9,1/1/2024 9:00,1402/10/11,78,SO,3,12,62.5,9,7.8,121.1,1,2024,1,0,0
22,12/31/2023 22:00,1402/10/10,78,SO,3,12.5,46.5,9,7.8,0,1.5,2024,1,0,0
11,1/1/2024 11:00,1402/10/11,81,SO,3,13.5,47,8.2,7.7,117.8,1.5,2024,1,0,0
24,1/1/2024 0:00,1402/10/11,95,SO,3,13,48.5,8.2,7.7,127.8,1.5,2024,1,1,0
13,1/1/2024 13:00,1402/10/11,90,SO,3,13,61.5,8,8.1,117,1.5,2024,1,1,0
2,1/2/2024 2:00,1402/10/12,87.5,SO,3,12.5,69.5,8,8.1,126.2,1,2024,1,1,0
3,1/2/2024 3:00,1402/10/12,87.5,SO,3,12,68,7.45,7.4,126.2,1,2024,1,1,0
4,1/2/2024 4:00,1402/10/12,87.5,SO,3,11,70,7.45,7.4,126.2,1,2024,1,1,0
17,1/1/2024 17:00,1402/10/11,87.5,SO,3,10.5,74,7.45,7.4,122.8,1.5,2024,1,1,0
6,1/2/2024 6:00,1402/10/12,87.5,SO,3,10,79.5,7.45,7.4,127,1,2024,1,1,0
19,1/1/2024 19:00,1402/10/11,87.5,SO,3,8.5,82.5,7.25,7.25,125.3,2.5,2024,1,1,0
20,1/1/2024 20:00,1402/10/11,90,SO,3,9.5,79,7.25,7.25,126.1,2.5,2024,1,1,0
9,1/2/2024 9:00,1402/10/12,91,SO,3,11.5,48,7.25,7.25,128.7,1,2024,1,1,0
10,1/2/2024 10:00,1402/10/12,94.5,LG3,3,12,50,7.25,7.25,127.8,1.5,2024,1,1,0
23,1/1/2024 23:00,1402/10/11,91,SO,3,12,46,7.1,7.05,127.8,1.5,2024,1,1,68.99999897
12,1/2/2024 12:00,1402/10/12,42.5,LG3,3,12.5,49,7.1,7.05,127,1.5,2024,1,2,35.00000051
1,1/3/2024 1:00,1402/10/13,42.5,FQ,3,13,54,7.8,7.6,126.2,1,2024,1,2,5.22E-07
2,1/3/2024 2:00,1402/10/13,42.5,FQ,3,13,56,7.8,7.6,126.2,1,2024,1,2,1.16E-22
3,1/3/2024 3:00,1402/10/13,42.5,FQ,3,12.5,54.5,7.8,7.65,126.2,1,2024,1,2,2.57E-38
4,1/3/2024 4:00,1402/10/13,42.5,FQ,3,12.5,69,7.8,7.65,126.2,1,2024,1,2,5.71E-54
5,1/3/2024 5:00,1402/10/13,42.5,FQ,3,11.5,74.5,7.8,7.65,127,1,2024,1,2,49.99999925
6,1/3/2024 6:00,1402/10/13,50,FQ,3,10.5,75,7.8,7.65,127,1,2024,1,2,50
19,1/2/2024 19:00,1402/10/12,50,LG3,3,11,74,8.6,8.2,123.8,2.5,2024,1,2,71.49999968
20,1/2/2024 20:00,1402/10/12,50,LG3,3,10,76.5,8.6,8.2,124.7,2.5,2024,1,2,71.00000001
21,1/2/2024 21:00,1402/10/12,50,LG3,3,12,55,8.6,8.2,124.7,2.5,2024,1,2,71
10,1/3/2024 10:00,1402/10/13,50,FQ,3,13,44.5,8.6,8.2,127.8,1.5,2024,1,2,71
23,1/2/2024 23:00,1402/10/12,50,LG3,3,12.5,47,8.6,8.2,124.7,1.5,2024,1,2,71
12,1/3/2024 12:00,1402/10/13,0,FQ,3,12.5,57.5,8.6,8.2,127,1.5,2024,1,3,30.00000061
1,1/4/2024 1:00,1402/10/14,0,FQ,3,13.5,58.5,6.7,6.9,126.2,1,2024,1,3,54.99999963
14,1/3/2024 14:00,1402/10/13,0,FQ,3,13,61.79999924,6.7,6.9,127,1.5,2024,1,3,67.49999981
15,1/3/2024 15:00,1402/10/13,0,FQ,3,13,65.5,6.7,6.9,127.8,1.5,2024,1,3,67.5
4,1/4/2024 4:00,1402/10/14,0,FQ,3,11.5,68.5,6.7,6.9,126.2,1,2024,1,3,67.99999999
17,1/3/2024 17:00,1402/10/13,0,FQ,3,10.5,74,6.7,6.9,125.3,1.5,2024,1,3,132.999999
18,1/3/2024 18:00,1402/10/13,0,FQ,3,9,79.5,6.7,6.9,125.3,2.5,2024,1,3,133
7,1/4/2024 7:00,1402/10/14,0,FQ,3,8,80,6.7,6.9,126.2,1,2024,1,3,130.5
20,1/3/2024 20:00,1402/10/13,0,FQ,3,8,80,6.7,6.9,124.7,2.5,2024,1,3,88.50000063
21,1/3/2024 21:00,1402/10/13,0,FQ,3,9.5,60.5,4.8,5.6,124.7,2.5,2024,1,3,78.00000016
22,1/3/2024 22:00,1402/10/13,0,FQ,3,11,44,4.8,5.6,124.7,1.5,2024,1,3,78
23,1/3/2024 23:00,1402/10/13,0,FQ,3,12,43.5,4.8,5.6,124.7,1.5,2024,1,3,80.99999996
24,1/4/2024 0:00,1402/10/14,0,R,3,11,40,4.8,5.6,124.7,1.5,2024,1,4,94.99999979
13,1/4/2024 13:00,1402/10/14,0,FQ,3,11,45,4.8,5.6,127,1.5,2024,1,4,90.00000007
2,1/5/2024 2:00,1402/10/15,0,R,3,11.5,45,4.8,5.6,126.2,1,2024,1,4,87.50000004
15,1/4/2024 15:00,1402/10/14,0,FQ,3,11,47.5,4.8,5.6,127.8,1.5,2024,1,4,87.5
16,1/4/2024 16:00,1402/10/14,0,FQ,3,10,55,4.8,5.6,124.5,1.5,2024,1,4,87.5
17,1/4/2024 17:00,1402/10/14,0,FQ,3,9,69.5,4.8,5.6,125.3,1.5,2024,1,4,87.5
6,1/5/2024 6:00,1402/10/15,61,R,3,7.5,73,4.8,5.6,127,1,2024,1,4,87.5
19,1/4/2024 19:00,1402/10/14,62,SO,3,7,75.5,4.8,5.6,123.8,2.5,2024,1,4,87.5
20,1/4/2024 20:00,1402/10/14,47.5,SO,3,7,71,4.8,5.6,124.7,2.5,2024,1,4,89.99999996
21,1/4/2024 21:00,1402/10/14,0,R,3,10,49,4.8,5.6,124.7,2.5,2024,1,4,90.99999999
10,1/5/2024 10:00,1402/10/15,0,R,3,11.5,36.5,4.8,5.6,127.8,1.5,2024,1,4,94.49999995
11,1/5/2024 11:00,1402/10/15,0,R,3,11.5,39.5,4.8,5.6,127.8,1.5,2024,1,4,91.00000005
12,1/5/2024 12:00,1402/10/15,0,R,3,11,38,4.8,5.6,127,1.5,2024,1,5,42.50000072
1,1/6/2024 1:00,1402/10/16,0,R,3,12,40.5,7.4,7.3,126.2,1,2024,1,5,42.5
14,1/5/2024 14:00,1402/10/15,0,R,3,11.5,45,7.4,7.3,127,1.5,2024,1,5,42.5
3,1/6/2024 3:00,1402/10/16,0,R,3,11.5,48,7.4,7.3,126.2,1,2024,1,5,42.5
16,1/5/2024 16:00,1402/10/15,0,R,3,11,54,7.4,7.3,124.5,1.5,2024,1,5,42.5
5,1/6/2024 5:00,1402/10/16,0,R,3,8.5,63.5,10,9,127,1,2024,1,5,42.5
6,1/6/2024 6:00,1402/10/16,0,R,3,7,66,10,9,127,1,2024,1,5,49.99999989
19,1/5/2024 19:00,1402/10/15,0,R,3,6,69,10,9,123.8,2.5,2024,1,5,50
8,1/6/2024 8:00,1402/10/16,0,R,3,6.5,67,10,9,125.3,1,2024,1,5,50
21,1/5/2024 21:00,1402/10/15,0,R,3,10,39.5,10,9,124.7,2.5,2024,1,5,50
22,1/5/2024 22:00,1402/10/15,67.5,R,3,10,37.5,10,9,124.7,1.5,2024,1,5,50
23,1/5/2024 23:00,1402/10/15,65,R,3,10,37.5,10,9,124.7,1.5,2024,1,5,50
12,1/6/2024 12:00,1402/10/16,127,SO,3,11.5,37.5,10,9,127,1.5,2024,1,6,7.45E-07
1,1/7/2024 1:00,1402/10/17,127,SO,3,11,39,9.8,8.9,130.3,1,2024,1,6,1.65E-22
2,1/7/2024 2:00,1402/10/17,115,SO,3,11.5,40,9.8,8.9,130.3,1,2024,1,6,3.67E-38
3,1/7/2024 3:00,1402/10/17,65,SO,3,11.5,41,8.95,8.35,131.2,1,2024,1,6,8.16E-54
16,1/6/2024 16:00,1402/10/16,65,LA,3,9.5,41.5,8.95,8.35,124.5,1.5,2024,1,6,1.81E-69
17,1/6/2024 17:00,1402/10/16,80,LA,3,8,49,9.05,8.45,125.3,1.5,2024,1,6,4.02E-85
18,1/6/2024 18:00,1402/10/16,100,LA,3,6,67.5,9.05,8.45,125.3,2.5,2024,1,6,8.93E-101
19,1/6/2024 19:00,1402/10/16,113.5,LA,3,6,68,9.45,8.75,123.8,2.5,2024,1,6,1.98E-116
20,1/6/2024 20:00,1402/10/16,111,LA,3,7,56,9.45,8.75,124.7,2.5,2024,1,6,4.40E-132
21,1/6/2024 21:00,1402/10/16,112,LA,3,9,35.5,9.45,8.75,124.7,2.5,2024,1,6,9.78E-148
10,1/7/2024 10:00,1402/10/17,112,SO,3,10.5,36,9.45,8.75,124.5,1.5,2024,1,6,2.17E-163
11,1/7/2024 11:00,1402/10/17,112,SO,3,10,36.5,9.15,8.55,127.8,1.5,2024,1,6,4.82E-179
12,1/7/2024 12:00,1402/10/17,50,SO,3,10,35.5,9.15,8.55,127,1.5,2024,1,0,1.07E-194
1,1/8/2024 1:00,1402/10/18,50,FQ,3,10,37,8.85,8.3,129.5,1,2024,1,0,2.38E-210
2,1/8/2024 2:00,1402/10/18,50,FQ,3,10.5,37,8.85,8.3,130.3,1,2024,1,0,5.28E-226
15,1/7/2024 15:00,1402/10/17,50,SO,3,10.5,39,9,8.3,127,1.5,2024,1,0,1.17E-241
16,1/7/2024 16:00,1402/10/17,50,SO,3,9.5,46.5,9,8.3,128.7,1.5,2024,1,0,2.60E-257
17,1/7/2024 17:00,1402/10/17,50,SO,3,8,47,9,8.3,125.3,1.5,2024,1,0,5.78E-273
6,1/8/2024 6:00,1402/10/18,50,FQ,3,6,49,9,8.3,129.5,1,2024,1,0,60.99999909
19,1/7/2024 19:00,1402/10/17,70,SO,3,6,55.5,9.55,8.8,125.5,2.5,2024,1,0,61.99999999
20,1/7/2024 20:00,1402/10/17,66.5,SO,3,5,57.5,9.55,8.8,125.5,2.5,2024,1,0,47.50000022
21,1/7/2024 21:00,1402/10/17,68.5,SO,3,8,46,9.55,8.8,125.5,2.5,2024,1,0,7.08E-07
10,1/8/2024 10:00,1402/10/18,17,FQ,3,9.5,33.5,9.55,8.8,127.8,1.5,2024,1,0,1.57E-22
23,1/7/2024 23:00,1402/10/17,0,FQ,3,10.5,33,9.55,8.8,126.3,1.5,2024,1,0,3.49E-38
24,1/8/2024 0:00,1402/10/18,50,SO,3,10.5,22.5,9.55,8.8,126.3,1.5,2024,1,1,7.75E-54
13,1/8/2024 13:00,1402/10/18,15,FQ,3,10.5,26.5,8.95,8.45,126.2,1.5,2024,1,1,1.72E-69
14,1/8/2024 14:00,1402/10/18,17.5,FQ,3,11,24.75,8.95,8.45,126.2,1.5,2024,1,1,3.82E-85
15,1/8/2024 15:00,1402/10/18,30,FQ,3,10.5,27,10.15,9.2,126.2,1.5,2024,1,1,8.48E-101
4,1/9/2024 4:00,1402/10/19,50,SO,3,10.5,29.5,10.15,9.2,130.3,1,2024,1,1,1.88E-116
17,1/8/2024 17:00,1402/10/18,63,FO,3,9,35,10.15,9.2,125.3,1.5,2024,1,1,4.18E-132
18,1/8/2024 18:00,1402/10/18,63,FO,3,6,36.5,10.15,9.2,125.3,2.5,2024,1,1,9.29E-148
19,1/8/2024 19:00,1402/10/18,63,FO,3,5,42.5,10.25,9.35,124.7,2.5,2024,1,1,2.06E-163
20,1/8/2024 20:00,1402/10/18,63,FO,3,4.5,40,10.25,9.35,125.5,2.5,2024,1,1,4.58E-179
21,1/8/2024 21:00,1402/10/18,131,SO,3,8.5,26.5,10.25,9.35,125.5,2.5,2024,1,1,1.02E-194
22,1/8/2024 22:00,1402/10/18,131,SO,3,9.5,19.5,10.25,9.35,126.3,1.5,2024,1,1,67.49999899
23,1/8/2024 23:00,1402/10/18,129.5,SO,3,10,20.5,9.25,8.55,126.3,1.5,2024,1,1,65.00000004
24,1/9/2024 0:00,1402/10/19,61,FO,3,11.5,21.5,9.25,8.55,126.3,1.5,2024,1,2,126.9999991
13,1/9/2024 13:00,1402/10/19,61,SO,3,11,26,10.5,9.35,127,1.5,2024,1,2,127
14,1/9/2024 14:00,1402/10/19,60,SO,3,11.5,26,10.5,9.35,127,1.5,2024,1,2,115.0000002
15,1/9/2024 15:00,1402/10/19,60,SO,3,11,27.5,10.4,9.2,127.8,1.5,2024,1,2,65.00000075
16,1/9/2024 16:00,1402/10/19,60,SO,3,11,30.5,10.4,9.2,124.5,1.5,2024,1,2,65
17,1/9/2024 17:00,1402/10/19,66,SO,3,9,34,10.4,9.2,126.2,1.5,2024,1,2,79.99999978
18,1/9/2024 18:00,1402/10/19,67,SO,3,6,40,10.4,9.2,126.2,2.5,2024,1,2,99.9999997
7,1/10/2024 7:00,1402/10/20,68.5,FO,3,5,45.5,10.3,9.2,129.5,1,2024,1,2,113.4999998
20,1/9/2024 20:00,1402/10/19,67,SO,3,6.5,45.5,10.3,9.2,125.5,2.5,2024,1,2,111
21,1/9/2024 21:00,1402/10/19,67,SO,3,6,42.5,10.2,9.25,125.5,2.5,2024,1,2,112
22,1/9/2024 22:00,1402/10/19,67,SO,3,7,38.5,10.2,9.25,125.5,1.5,2024,1,2,112
23,1/9/2024 23:00,1402/10/19,0,FO,3,8,36.5,10.2,9.25,126.3,1.5,2024,1,2,112
12,1/10/2024 12:00,1402/10/20,0,FO,3,8,36.5,10.2,9.25,127,1.5,2024,1,3,50.00000092
13,1/10/2024 13:00,1402/10/20,0,FO,3,9,28.5,10.1,9.3,127,1.5,2024,1,3,50
14,1/10/2024 14:00,1402/10/20,0,FO,3,10.5,19,10.1,9.3,127,1.5,2024,1,3,50
3,1/11/2024 3:00,1402/10/21,0,R,3,10.5,22.5,10.1,9.3,128.7,1,2024,1,3,50
4,1/11/2024 4:00,1402/10/21,0,R,3,9.5,24.5,10.1,9.3,128.7,1,2024,1,3,50
17,1/10/2024 17:00,1402/10/20,0,FO,3,7,33,10.1,9.3,126.2,1.5,2024,1,3,50
18,1/10/2024 18:00,1402/10/20,68.5,SO,3,5,40.5,10.1,9.3,126.2,2.5,2024,1,3,50
7,1/11/2024 7:00,1402/10/21,67.5,R,3,4,44,10.1,9.3,128.7,1,2024,1,3,69.9999997
20,1/10/2024 20:00,1402/10/20,68,SO,3,3,44,10.1,9.3,125.5,2.5,2024,1,3,66.50000005
21,1/10/2024 21:00,1402/10/20,68.5,SO,3,7.5,23.5,10.1,9.3,125.5,2.5,2024,1,3,68.49999997
22,1/10/2024 22:00,1402/10/20,69.5,SO,3,7,24,10.1,9.3,125.5,1.5,2024,1,3,17.00000077
23,1/10/2024 23:00,1402/10/20,50,SO,3,8.5,8.5,10.1,9.3,126.3,1.5,2024,1,3,2.53E-07
12,1/11/2024 12:00,1402/10/21,0,FG3,3,10.5,22,10.1,9.3,127.8,1.5,2024,1,4,49.99999925
1,1/12/2024 1:00,1402/10/22,0,FG3,3,12,24.5,10.1,9.3,127.8,1,2024,1,4,15.00000052
14,1/11/2024 14:00,1402/10/21,0,FG3,3,13,26.5,10.1,9.3,127,1.5,2024,1,4,17.49999996
15,1/11/2024 15:00,1402/10/21,0,FG3,3,12,28.5,10.1,9.3,127.8,1.5,2024,1,4,29.99999981
16,1/11/2024 16:00,1402/10/21,0,FG3,3,12,29.5,10.1,9.3,124.5,1.5,2024,1,4,49.9999997
17,1/11/2024 17:00,1402/10/21,0,FG3,3,11,31.5,10.1,9.3,125.3,1.5,2024,1,4,62.99999981
18,1/11/2024 18:00,1402/10/21,0,FG3,3,9,34,10.1,9.3,126.2,2.5,2024,1,4,63
7,1/12/2024 7:00,1402/10/22,0,FG3,3,8,34,10.1,9.3,129.5,1,2024,1,4,63
20,1/11/2024 20:00,1402/10/21,0,FG3,3,8,39,10.1,9.3,125.5,2.5,2024,1,4,63
21,1/11/2024 21:00,1402/10/21,0,FG3,3,8.5,36.5,10.1,9.3,125.5,2.5,2024,1,4,130.999999
22,1/11/2024 22:00,1402/10/21,0,FG3,3,10,42,10.1,9.3,125.5,1.5,2024,1,4,131
23,1/11/2024 23:00,1402/10/21,0,FG3,3,9.5,35.5,10.1,9.3,126.3,1.5,2024,1,4,129.5
24,1/12/2024 0:00,1402/10/22,0,FG3,3,10,49,10.1,9.3,126.3,1.5,2024,1,5,61.00000102
1,1/13/2024 1:00,1402/10/23,0,FG3,3,10,55,10.4,9.45,127.8,1,2024,1,5,61
14,1/12/2024 14:00,1402/10/22,0,FG3,3,11,47.5,10.4,9.45,127,1.5,2024,1,5,60.00000001
15,1/12/2024 15:00,1402/10/22,0,FG3,3,10.5,57,10.4,9.45,127.8,1.5,2024,1,5,60
16,1/12/2024 16:00,1402/10/22,0,FG3,3,11,58,10.4,9.45,124.5,1.5,2024,1,5,60
17,1/12/2024 17:00,1402/10/22,0,FG3,3,10,61,10.4,9.45,126.2,1.5,2024,1,5,65.99999991
6,1/13/2024 6:00,1402/10/23,0,FG3,3,8,65,10.4,9.45,130.3,1,2024,1,5,66.99999999
19,1/12/2024 19:00,1402/10/22,0,FG3,3,7.5,64.5,10.4,9.45,125.5,2.5,2024,1,5,68.49999998
20,1/12/2024 20:00,1402/10/22,0,FG3,3,6.5,67.5,10.4,9.45,125.5,2.5,2024,1,5,67.00000002
21,1/12/2024 21:00,1402/10/22,0,FG3,3,9.5,51,10.7,9.6,125.5,2.5,2024,1,5,67
22,1/12/2024 22:00,1402/10/22,0,FG3,3,13,68.5,10.7,9.6,125.5,1.5,2024,1,5,67
11,1/13/2024 11:00,1402/10/23,0,FG3,3,12.5,36.5,10.7,9.6,127.8,1.5,2024,1,5,9.98E-07
12,1/13/2024 12:00,1402/10/23,0,FG3,3,13.5,39,10.7,9.6,127,1.5,2024,1,6,2.22E-22
1,1/14/2024 1:00,1402/10/24,0,FG3,3,14,40,10.7,9.6,127.8,1,2024,1,6,4.92E-38
14,1/13/2024 14:00,1402/10/23,0,FG3,3,14.5,38,10.7,9.6,127,1.5,2024,1,6,1.09E-53
15,1/13/2024 15:00,1402/10/23,0,FG3,3,14,42,10.7,9.6,127.8,1.5,2024,1,6,2.43E-69
4,1/14/2024 4:00,1402/10/24,0,FG3,3,13.5,43.5,10.7,9.6,127.8,1,2024,1,6,5.39E-85
17,1/13/2024 17:00,1402/10/23,0,FG3,3,12.5,49,10.7,9.6,126.2,1.5,2024,1,6,1.20E-100
6,1/14/2024 6:00,1402/10/24,0,FG3,3,11.5,55,10.7,9.6,127.8,1,2024,1,6,68.49999898
19,1/13/2024 19:00,1402/10/23,0,FG3,3,10.5,57.5,10.7,9.6,125.5,2.5,2024,1,6,67.50000001
20,1/13/2024 20:00,1402/10/23,0,FG3,3,9.5,59,10.7,9.6,125.5,2.5,2024,1,6,67.99999999
9,1/14/2024 9:00,1402/10/24,0,FG3,3,10.5,54.5,10.7,9.6,127.8,1,2024,1,6,68.49999999
10,1/14/2024 10:00,1402/10/24,0,FG3,3,13,49.5,10.7,9.6,127,1.5,2024,1,6,69.49999999
23,1/13/2024 23:00,1402/10/23,0,FG3,3,12.5,52.5,10.7,9.6,126.3,1.5,2024,1,6,50.00000029
12,1/14/2024 12:00,1402/10/24,0,FG3,3,14.5,53,10.7,9.6,127,1.5,2024,1,0,7.45E-07
13,1/14/2024 13:00,1402/10/24,0,FG3,3,14,50,10.7,9.6,126.2,1.5,2024,1,0,1.65E-22
2,1/15/2024 2:00,1402/10/25,0,FQ,3,13,57,10.7,9.6,124.5,1,2024,1,0,3.67E-38
15,1/14/2024 15:00,1402/10/24,0,FG3,3,13.5,60.5,10.7,9.6,126.2,1.5,2024,1,0,8.16E-54
16,1/14/2024 16:00,1402/10/24,0,FG3,3,12.5,60.5,10.7,9.6,127,1.5,2024,1,0,1.81E-69
5,1/15/2024 5:00,1402/10/25,27.5,FQ,3,12,58.5,10.7,9.6,126.2,1,2024,1,0,4.02E-85
18,1/14/2024 18:00,1402/10/24,68.5,SO,3,11,66,10.7,9.6,127.8,2.5,2024,1,0,8.93E-101
19,1/14/2024 19:00,1402/10/24,68.5,SO,3,10.5,67,10.7,9.6,127.2,2.5,2024,1,0,1.98E-116
20,1/14/2024 20:00,1402/10/24,69,SO,3,10.5,60.5,10.7,9.6,127.2,2.5,2024,1,0,4.40E-132
21,1/14/2024 21:00,1402/10/24,69.5,SO,3,13.5,41.5,10.7,9.6,127.2,2.5,2024,1,0,9.78E-148
10,1/15/2024 10:00,1402/10/25,0,FQ,3,14,45.5,10.7,9.6,126.2,1.5,2024,1,0,2.17E-163
23,1/14/2024 23:00,1402/10/24,0,FQ,3,15.5,37.5,10.7,9.6,123,1.5,2024,1,0,4.82E-179
12,1/15/2024 12:00,1402/10/25,0,FQ,3,15.5,38,10.7,9.6,125.3,1.5,2024,1,1,1.07E-194
13,1/15/2024 13:00,1402/10/25,0,FQ,3,15.5,40.5,10.7,9.6,124.5,1.5,2024,1,1,2.38E-210
14,1/15/2024 14:00,1402/10/25,0,FQ,3,16,46,10.7,9.6,124.5,1.5,2024,1,1,5.28E-226
15,1/15/2024 15:00,1402/10/25,0,FQ,3,15.5,49,10.7,9.6,124.5,1.5,2024,1,1,1.17E-241
16,1/15/2024 16:00,1402/10/25,0,FQ,3,15,55,10.7,9.6,125.3,1.5,2024,1,1,2.60E-257
5,1/16/2024 5:00,1402/10/26,0,FQ,3,14,53,10.7,9.6,126.2,1,2024,1,1,5.78E-273
6,1/16/2024 6:00,1402/10/26,0,FQ,3,12,57,10.7,9.6,127,1,2024,1,1,1.28E-288
7,1/16/2024 7:00,1402/10/26,0,FQ,3,11,61.5,10.7,9.6,126.2,1,2024,1,1,2.85E-304
8,1/16/2024 8:00,1402/10/26,0,FQ,3,11.5,58,10.7,9.6,125.3,1,2024,1,1,6.324e-320
9,1/16/2024 9:00,1402/10/26,0,FQ,3,12.5,50,10.7,9.6,127.8,1,2024,1,1,0
22,1/15/2024 22:00,1402/10/25,0,FQ,3,13.5,31,10.7,9.6,126.3,1.5,2024,1,1,0
11,1/16/2024 11:00,1402/10/26,0,FQ,3,14.5,30.5,10.7,9.6,125.3,1.5,2024,1,1,0
12,1/16/2024 12:00,1402/10/26,0,FQ,3,14,43,10.7,9.6,125.3,1.5,2024,1,2,0
1,1/17/2024 1:00,1402/10/27,0,FQ,3,13.5,42.5,10.7,9.6,127.8,1,2024,1,2,0
14,1/16/2024 14:00,1402/10/26,0,FQ,3,14,39,10.7,9.6,124.5,1.5,2024,1,2,0
3,1/17/2024 3:00,1402/10/27,0,FQ,3,13,45.5,10.7,9.6,128.7,1,2024,1,2,0
16,1/16/2024 16:00,1402/10/26,0,FQ,3,12,49.5,10.7,9.6,125.3,1.5,2024,1,2,0
5,1/17/2024 5:00,1402/10/27,0,FQ,3,10.5,53,10.7,9.6,128.7,1,2024,1,2,0
6,1/17/2024 6:00,1402/10/27,0,FQ,3,8,52.5,10.7,9.6,128.7,1,2024,1,2,0
19,1/16/2024 19:00,1402/10/26,0,FQ,3,7,54.5,10.7,9.6,125.5,2.5,2024,1,2,0
20,1/16/2024 20:00,1402/10/26,0,FQ,3,8,54.5,10.7,9.6,126.3,2.5,2024,1,2,0
21,1/16/2024 21:00,1402/10/26,0,FQ,3,11.5,27.5,10.7,9.6,126.3,2.5,2024,1,2,0
22,1/16/2024 22:00,1402/10/26,0,FQ,3,11.5,23.5,10.7,9.6,126.3,1.5,2024,1,2,0
11,1/17/2024 11:00,1402/10/27,0,FO,3,11.5,28.5,10.7,9.6,128.7,1.5,2024,1,2,0
12,1/17/2024 12:00,1402/10/27,0,FO,3,10.5,46.5,10.7,9.6,127.8,1.5,2024,1,3,0
13,1/17/2024 13:00,1402/10/27,0,FO,3,11,45,10.7,9.6,127.8,1.5,2024,1,3,0
14,1/17/2024 14:00,1402/10/27,0,FO,3,11.5,44,10.7,9.6,127.8,1.5,2024,1,3,0
15,1/17/2024 15:00,1402/10/27,0,FO,3,11.5,47,10.7,9.6,128.7,1.5,2024,1,3,0
16,1/17/2024 16:00,1402/10/27,0,FO,3,11,55,10.7,9.6,128.7,1.5,2024,1,3,0
5,1/18/2024 5:00,1402/10/28,0,FO,3,9,60,10.7,9.6,128.7,1,2024,1,3,27.49999959
18,1/17/2024 18:00,1402/10/27,0,FO,3,7,70.5,10.7,9.6,124.5,2.5,2024,1,3,68.49999939
7,1/18/2024 7:00,1402/10/28,0,FO,3,6.5,73,10.7,9.6,128.7,1,2024,1,3,68.5
8,1/18/2024 8:00,1402/10/28,0,FO,3,8,67.5,10.7,9.6,127.8,1,2024,1,3,68.99999999
9,1/18/2024 9:00,1402/10/28,0,FO,3,9.5,50.5,10.7,9.6,126.2,1,2024,1,3,69.49999999
22,1/17/2024 22:00,1402/10/27,0,FO,3,7.5,40,10.7,9.6,124.7,1.5,2024,1,3,1.04E-06
11,1/18/2024 11:00,1402/10/28,15,FO,3,10.5,39,10.7,9.6,128.7,1.5,2024,1,3,2.30E-22
12,1/18/2024 12:00,1402/10/28,72.5,LA,3,12,37.5,10.7,9.6,127.8,1.5,2024,1,4,5.11E-38
13,1/18/2024 13:00,1402/10/28,77.5,LA,3,11.5,41,10.15,9.15,127.8,1.5,2024,1,4,1.13E-53
14,1/18/2024 14:00,1402/10/28,100,LA,3,12,39.5,10.15,9.15,127.8,1.5,2024,1,4,2.52E-69
15,1/18/2024 15:00,1402/10/28,109,SO,3,12.5,41,8.35,7.9,128.7,1.5,2024,1,4,5.59E-85
16,1/18/2024 16:00,1402/10/28,100,SO,3,11.5,45.5,8.35,7.9,128.7,1.5,2024,1,4,1.24E-100
17,1/18/2024 17:00,1402/10/28,105,SO,3,9.5,54.5,8.35,7.9,128.7,1.5,2024,1,4,2.76E-116
18,1/18/2024 18:00,1402/10/28,111,LG3,3,8.5,56.5,8.35,7.9,124.5,2.5,2024,1,4,6.12E-132
7,1/19/2024 7:00,1402/10/29,113,LG3,3,7,65,9.35,8.6,128.7,1,2024,1,4,1.36E-147
20,1/18/2024 20:00,1402/10/28,111.5,LG3,3,7.5,63.5,9.35,8.6,123,2.5,2024,1,4,3.02E-163
9,1/19/2024 9:00,1402/10/29,111.5,LG3,3,9.5,46,9.35,8.6,126.2,1,2024,1,4,6.70E-179
10,1/19/2024 10:00,1402/10/29,117.5,LG3,3,11.5,32,9.35,8.6,124.5,1.5,2024,1,4,1.49E-194
23,1/18/2024 23:00,1402/10/28,117.5,LG3,3,12,35,10.2,9.05,125.5,1.5,2024,1,4,3.30E-210
24,1/19/2024 0:00,1402/10/29,124,SO,3,11,34,10.2,9.05,125.5,1.5,2024,1,5,7.33E-226
13,1/19/2024 13:00,1402/10/29,115,LG3,3,11.5,39,10.35,9.3,127.8,1.5,2024,1,5,1.63E-241
2,1/20/2024 2:00,1402/10/30,115,SO,3,12,35,10.35,9.3,127.8,1,2024,1,5,3.62E-257
3,1/20/2024 3:00,1402/10/30,100,SO,3,11.5,39,8.05,7.85,128.7,1,2024,1,5,8.03E-273
4,1/20/2024 4:00,1402/10/30,102.5,SO,3,10,44,8.05,7.85,128.7,1,2024,1,5,1.78E-288
5,1/20/2024 5:00,1402/10/30,102.5,SO,3,9,54.5,8.05,7.85,128.7,1,2024,1,5,3.96E-304
6,1/20/2024 6:00,1402/10/30,119,SO,3,7.5,55.5,8.05,7.85,128.7,1,2024,1,5,8.7904e-320
19,1/19/2024 19:00,1402/10/29,118.5,SO,3,7,60.5,9.45,8.75,123,2.5,2024,1,5,0
20,1/19/2024 20:00,1402/10/29,117.5,SO,3,7,60,9.45,8.75,123,2.5,2024,1,5,0
21,1/19/2024 21:00,1402/10/29,121,SO,3,10,47.5,9.45,8.75,123.8,2.5,2024,1,5,0
22,1/19/2024 22:00,1402/10/29,121,SO,3,10,31,9.45,8.75,124.7,1.5,2024,1,5,0
11,1/20/2024 11:00,1402/10/30,121,LG3,3,11,29.5,9.65,8.9,128.7,1.5,2024,1,5,0
24,1/20/2024 0:00,1402/10/30,116.5,SO,3,13,29,9.65,8.9,125.5,1.5,2024,1,6,0
1,1/21/2024 1:00,1402/11/01,106.5,SO,3,14,29.5,9.95,8.9,127.8,1,2024,1,6,0
2,1/21/2024 2:00,1402/11/01,107.5,SO,3,13.5,30,9.95,8.9,127.8,1,2024,1,6,0
3,1/21/2024 3:00,1402/11/01,107.5,SO,3,13,33.5,9.15,8.5,128.7,1,2024,1,6,0
4,1/21/2024 4:00,1402/11/01,108,SO,3,12,36.5,9.15,8.5,128.7,1,2024,1,6,0
17,1/20/2024 17:00,1402/10/30,108,LG3,3,11,41,9.15,8.5,128.7,1.5,2024,1,6,0
18,1/20/2024 18:00,1402/10/30,123,SO,3,9,44,9.15,8.5,124.5,2.5,2024,1,6,0
19,1/20/2024 19:00,1402/10/30,123,SO,3,7.5,47,8.85,8.3,123,2.5,2024,1,6,0
8,1/21/2024 8:00,1402/11/01,105,SO,3,8.5,45,8.85,8.3,127.8,1,2024,1,6,0
9,1/21/2024 9:00,1402/11/01,103.5,SO,3,9.5,39,8.85,8.3,126.2,1,2024,1,6,0
22,1/20/2024 22:00,1402/10/30,103.5,SO,3,11.5,26,8.85,8.3,124.7,1.5,2024,1,6,0
23,1/20/2024 23:00,1402/10/30,104,SO,3,12.5,25,10.45,9.15,125.5,1.5,2024,1,6,14.99999978
24,1/21/2024 0:00,1402/11/01,122,SO,3,12,31.5,10.45,9.15,125.5,1.5,2024,1,0,72.49999914
1,1/22/2024 1:00,1402/11/02,122,SO,3,12,36.5,10.2,9.15,127,1,2024,1,0,77.49999993
2,1/22/2024 2:00,1402/11/02,122,SO,3,12,34,10.2,9.15,127,1,2024,1,0,99.99999966
3,1/22/2024 3:00,1402/11/02,122.5,SO,3,12.5,37.5,10.3,9.25,127.8,1,2024,1,0,108.9999999
4,1/22/2024 4:00,1402/11/02,122.5,SO,3,11.5,39,10.3,9.25,128.7,1,2024,1,0,100.0000001
17,1/21/2024 17:00,1402/11/01,122.5,SO,3,10,48,10.3,9.25,128.7,1.5,2024,1,0,104.9999999
6,1/22/2024 6:00,1402/11/02,122.5,SO,3,7.5,53,10.3,9.25,128.7,1,2024,1,0,110.9999999
19,1/21/2024 19:00,1402/11/01,123.5,SO,3,7,54.5,10.25,9.25,123,2.5,2024,1,0,113
20,1/21/2024 20:00,1402/11/01,123.5,SO,3,7,54.5,10.25,9.25,123,2.5,2024,1,0,111.5
9,1/22/2024 9:00,1402/11/02,123.5,SO,3,10.5,41.5,10.25,9.25,125.3,1,2024,1,0,111.5
22,1/21/2024 22:00,1402/11/01,127,SO,3,12,29,10.25,9.25,124.7,1.5,2024,1,0,117.4999999
23,1/21/2024 23:00,1402/11/01,125.5,SO,3,13,27.5,10.25,9.25,125.5,1.5,2024,1,0,117.5
24,1/22/2024 0:00,1402/11/02,126,LF1,3,12,27.5,10.25,9.25,126.3,1.5,2024,1,1,123.9999999
13,1/22/2024 13:00,1402/11/02,126,LF1,3,13,27.5,10.2,9.25,127.8,1.5,2024,1,1,115.0000001
14,1/22/2024 14:00,1402/11/02,126,LF1,3,13.5,28,10.2,9.25,127.8,1.5,2024,1,1,115
15,1/22/2024 15:00,1402/11/02,109,LF1,3,13,28.5,9,8.45,127.8,1.5,2024,1,1,100.0000002
16,1/22/2024 16:00,1402/11/02,109,LF1,3,12.5,31.5,9,8.45,128.7,1.5,2024,1,1,102.5
17,1/22/2024 17:00,1402/11/02,110,LF1,3,10.5,37.5,9.25,8.5,124.5,1.5,2024,1,1,102.5
18,1/22/2024 18:00,1402/11/02,111.5,LF1,3,8.5,44.5,9.25,8.5,124.5,2.5,2024,1,1,118.9999998
7,1/23/2024 7:00,1402/11/03,111.5,LF1,3,7.5,45.5,9.5,8.7,126.2,1,2024,1,1,118.5
20,1/22/2024 20:00,1402/11/02,112,LF1,3,8,45.5,9.5,8.7,123.8,2.5,2024,1,1,117.5
21,1/22/2024 21:00,1402/11/02,106,LF1,3,10.5,34.5,9.5,8.7,123.8,2.5,2024,1,1,120.9999999
10,1/23/2024 10:00,1402/11/03,107,LF1,3,12,23.5,9.5,8.7,125.3,1.5,2024,1,1,121
23,1/22/2024 23:00,1402/11/02,107,LF1,3,12.5,23.5,8.7,8.15,125.5,1.5,2024,1,1,121
24,1/23/2024 0:00,1402/11/03,105,LG3,3,16,20.5,8.7,8.15,127.2,1.5,2024,1,2,116.5000001
1,1/24/2024 1:00,1402/11/04,100,LG3,3,16,26,8.8,8.1,126.2,1,2024,1,2,106.5000001
14,1/23/2024 14:00,1402/11/03,100,LG3,3,17,19.5,8.8,8.1,123.6,1.5,2024,1,2,107.5
15,1/23/2024 15:00,1402/11/03,100,LG3,3,16,20.5,8.8,8.05,124.5,1.5,2024,1,2,107.5
16,1/23/2024 16:00,1402/11/03,102,LG3,3,15.5,19,8.8,8.05,125.3,1.5,2024,1,2,108
17,1/23/2024 17:00,1402/11/03,103.5,LG3,3,14.5,31.5,8.8,8.05,127,1.5,2024,1,2,108
18,1/23/2024 18:00,1402/11/03,128,LG3,3,12,33.5,8.8,8.05,127,2.5,2024,1,2,122.9999998
7,1/24/2024 7:00,1402/11/04,130,LG3,3,11.5,31,10.25,9.35,126.2,1,2024,1,2,123
20,1/23/2024 20:00,1402/11/03,131,LG3,3,10.5,30.5,10.25,9.35,126.3,2.5,2024,1,2,105.0000003
21,1/23/2024 21:00,1402/11/03,132,LG3,3,10.5,35,10.25,9.35,126.3,2.5,2024,1,2,103.5
22,1/23/2024 22:00,1402/11/03,132,LG3,3,11.5,29,10.25,9.35,126.3,1.5,2024,1,2,103.5
23,1/23/2024 23:00,1402/11/03,125,LG3,3,13.5,22.5,10.35,9.2,126.3,1.5,2024,1,2,104
24,1/24/2024 0:00,1402/11/04,130.5,LF1,3,16,30.5,10.35,9.2,127.2,1.5,2024,1,3,121.9999997
1,1/25/2024 1:00,1402/11/05,131,LF1,3,16,30,10.55,9.35,125.3,1,2024,1,3,122
14,1/24/2024 14:00,1402/11/04,130,LG3,3,16.5,29.5,10.55,9.35,123.6,1.5,2024,1,3,122
15,1/24/2024 15:00,1402/11/04,129.5,LG3,3,16,32,10.45,9.25,124.5,1.5,2024,1,3,122.5
16,1/24/2024 16:00,1402/11/04,129.5,LG3,3,15.5,33,10.45,9.25,125.3,1.5,2024,1,3,122.5
5,1/25/2024 5:00,1402/11/05,129.5,LF1,3,14,36,10.45,9.25,127,1,2024,1,3,122.5
18,1/24/2024 18:00,1402/11/04,130,LF1,3,12.5,38,10.45,9.25,127,2.5,2024,1,3,122.5
19,1/24/2024 19:00,1402/11/04,130.5,LF1,3,11.5,40.5,10.4,9.25,125.5,2.5,2024,1,3,123.5
20,1/24/2024 20:00,1402/11/04,131,LF1,3,11.5,39,10.4,9.25,126.3,2.5,2024,1,3,123.5
9,1/25/2024 9:00,1402/11/05,131,LF1,3,15,28.5,10.4,9.25,127.8,1,2024,1,3,123.5
10,1/25/2024 10:00,1402/11/05,131.5,LF1,3,15.5,24,10.4,9.25,126.2,1.5,2024,1,3,126.9999999
23,1/24/2024 23:00,1402/11/04,131,LF1,3,16.5,27.5,10.4,9.3,126.3,1.5,2024,1,3,125.5
24,1/25/2024 0:00,1402/11/05,130,LF1,3,16.5,32.5,10.4,9.3,127.2,1.5,2024,1,4,126
13,1/25/2024 13:00,1402/11/05,130,LF1,3,16,33.5,10.45,9.25,123.6,1.5,2024,1,4,126
2,1/26/2024 2:00,1402/11/06,130.5,LF1,3,16.5,33,10.45,9.25,126.2,1,2024,1,4,126
3,1/26/2024 3:00,1402/11/06,128.5,LF1,3,16.5,32,10.3,9.155,126.2,1,2024,1,4,109.0000003
4,1/26/2024 4:00,1402/11/06,128.5,LF1,3,16,36,10.3,9.155,127,1,2024,1,4,109
5,1/26/2024 5:00,1402/11/06,129,LF1,3,16,42.5,10.3,9.155,127,1,2024,1,4,110
18,1/25/2024 18:00,1402/11/05,129.5,LF1,3,15,46,10.3,9.155,127,2.5,2024,1,4,111.5
19,1/25/2024 19:00,1402/11/05,129,LF1,3,14,42,10.45,9.3,125.5,2.5,2024,1,4,111.5
8,1/26/2024 8:00,1402/11/06,130,LF1,3,14.5,39.5,10.45,9.3,125.3,1,2024,1,4,112
21,1/25/2024 21:00,1402/11/05,131.5,LF1,3,14,39.5,10.45,9.3,126.3,2.5,2024,1,4,106.0000001
22,1/25/2024 22:00,1402/11/05,127,LF1,3,15,47.5,10.45,9.3,126.3,1.5,2024,1,4,107
23,1/25/2024 23:00,1402/11/05,129,LF1,3,15,48.5,10.45,9.3,126.3,1.5,2024,1,4,107
24,1/26/2024 0:00,1402/11/06,128,LF1,3,16,50.5,10.45,9.3,127.2,1.5,2024,1,5,105
13,1/26/2024 13:00,1402/11/06,128,LF1,3,15.5,48,10.3,9.2,123.6,1.5,2024,1,5,100.0000001
2,1/27/2024 2:00,1402/11/07,129,LF1,3,14.5,49.5,10.3,9.2,126.2,1,2024,1,5,100
3,1/27/2024 3:00,1402/11/07,128.5,LF1,3,14.5,46,10.5,9.1,126.2,1,2024,1,5,100
4,1/27/2024 4:00,1402/11/07,128.5,LF1,3,14.5,47,10.5,9.1,127,1,2024,1,5,102
5,1/27/2024 5:00,1402/11/07,128,LF1,3,14.5,50.5,10.5,9.1,127,1,2024,1,5,103.5
6,1/27/2024 6:00,1402/11/07,134,LF1,3,14,54.5,10.5,9.1,127,1,2024,1,5,127.9999996
19,1/26/2024 19:00,1402/11/06,133.5,LF1,3,14,55.5,10.6,9.45,125.5,2.5,2024,1,5,130
20,1/26/2024 20:00,1402/11/06,133.5,LF1,3,13.5,53.5,10.6,9.45,126.3,2.5,2024,1,5,131
21,1/26/2024 21:00,1402/11/06,132.5,LF1,3,13.5,57.5,10.6,9.45,126.3,2.5,2024,1,5,132
22,1/26/2024 22:00,1402/11/06,132.5,LF1,3,15,47,10.6,9.45,126.3,1.5,2024,1,5,132
11,1/27/2024 11:00,1402/11/07,131,LF1,3,16.5,41.5,10.45,9.25,125.3,1.5,2024,1,5,125.0000001
24,1/27/2024 0:00,1402/11/07,132,SO,3,13.5,65.5,10.45,9.25,127.2,1.5,2024,1,6,130.4999999
13,1/27/2024 13:00,1402/11/07,133,LF1,3,13,64.5,10.6,9.3,123.6,1.5,2024,1,6,131
14,1/27/2024 14:00,1402/11/07,133.5,LF1,3,12.5,63.5,10.6,9.3,123.6,1.5,2024,1,6,130
15,1/27/2024 15:00,1402/11/07,134.5,LF1,3,11.5,68,10.6,9.3,124.5,1.5,2024,1,6,129.5
16,1/27/2024 16:00,1402/11/07,134,LF1,3,11.5,72,10.6,9.3,125.3,1.5,2024,1,6,129.5
17,1/27/2024 17:00,1402/11/07,134,LF1,3,10.5,74,10.6,9.3,127,1.5,2024,1,6,129.5
6,1/28/2024 6:00,1402/11/08,134.5,SO,3,9,86.5,10.6,9.3,130.3,1,2024,1,6,130
7,1/28/2024 7:00,1402/11/08,134.5,SO,3,8.5,87,9.2,8.6,130.3,1,2024,1,6,130.5
20,1/27/2024 20:00,1402/11/07,116,SO,3,9,90,9.2,8.6,126.3,2.5,2024,1,6,131
9,1/28/2024 9:00,1402/11/08,126,SO,3,9.5,68.5,9.2,8.6,126.2,1,2024,1,6,131
22,1/27/2024 22:00,1402/11/07,126,SO,3,11.5,59.5,9.2,8.6,126.3,1.5,2024,1,6,131.5
23,1/27/2024 23:00,1402/11/07,126.5,SO,3,11,57,10.55,9.3,126.3,1.5,2024,1,6,131
24,1/28/2024 0:00,1402/11/08,116,SO,3,11,42,10.55,9.3,126.3,1.5,2024,1,0,130
13,1/28/2024 13:00,1402/11/08,116,SO,3,11.5,40.5,9.95,9,124.5,1.5,2024,1,0,130
14,1/28/2024 14:00,1402/11/08,116,SO,3,11,37.5,9.95,9,124.5,1.5,2024,1,0,130.5
15,1/28/2024 15:00,1402/11/08,116,SO,3,10.5,40,10.05,9.05,124.5,1.5,2024,1,0,128.5
4,1/29/2024 4:00,1402/11/09,116,SO,3,10,10,10.05,9.05,129.5,1,2024,1,0,128.5
17,1/28/2024 17:00,1402/11/08,117,SO,3,8.5,51.5,10.05,9.05,126.2,1.5,2024,1,0,129
6,1/29/2024 6:00,1402/11/09,117,SO,3,6.5,58,10.05,9.05,130.3,1,2024,1,0,129.5
19,1/28/2024 19:00,1402/11/08,117,SO,3,6,56,9.75,8.9,124.7,2.5,2024,1,0,129
20,1/28/2024 20:00,1402/11/08,117,SO,3,6.5,56,9.75,8.9,125.5,2.5,2024,1,0,130
21,1/28/2024 21:00,1402/11/08,106,SO,3,8,45.5,9.75,8.9,125.5,2.5,2024,1,0,131.5
22,1/28/2024 22:00,1402/11/08,117,SO,3,10,32.5,9.75,8.9,126.3,1.5,2024,1,0,127.0000001
23,1/28/2024 23:00,1402/11/08,117,SO,3,10,30.5,9.9,8.8,126.3,1.5,2024,1,0,129
24,1/29/2024 0:00,1402/11/09,56,FQ,3,11,26.5,9.9,8.8,126.3,1.5,2024,1,1,128
1,1/30/2024 1:00,1402/11/10,55,FQ,3,12,30,10.45,9.05,126.2,1,2024,1,1,128
14,1/29/2024 14:00,1402/11/09,55,LG3,3,12.5,27.5,10.45,9.05,124.5,1.5,2024,1,1,129
15,1/29/2024 15:00,1402/11/09,55,LG3,3,12,30,10.5,9.1,124.5,1.5,2024,1,1,128.5
16,1/29/2024 16:00,1402/11/09,55,LG3,3,12,33,10.5,9.1,125.3,1.5,2024,1,1,128.5
17,1/29/2024 17:00,1402/11/09,55,LG3,3,10.5,38.5,10.5,9.1,126.2,1.5,2024,1,1,128
6,1/30/2024 6:00,1402/11/10,55,FQ,3,9.5,41.5,10.5,9.1,127.8,1,2024,1,1,133.9999999
19,1/29/2024 19:00,1402/11/09,55,LG3,3,9,41.5,10.5,9.1,124.7,2.5,2024,1,1,133.5
20,1/29/2024 20:00,1402/11/09,4.5,LG3,3,9,44.5,10.5,9.1,125.5,2.5,2024,1,1,133.5
21,1/29/2024 21:00,1402/11/09,0,FQ,3,9.5,45.5,10.5,9.1,125.5,2.5,2024,1,1,132.5
22,1/29/2024 22:00,1402/11/09,0,FQ,3,10,43,10.5,9.1,126.3,1.5,2024,1,1,132.5
11,1/30/2024 11:00,1402/11/10,0,FQ,3,10.5,46,10.5,9.1,127.8,1.5,2024,1,1,131
12,1/30/2024 12:00,1402/11/10,0,FQ,3,11,56.5,10.5,9.1,127.8,1.5,2024,1,2,132
13,1/30/2024 13:00,1402/11/10,0,FQ,3,11.5,54,10.5,9.1,127,1.5,2024,1,2,133
14,1/30/2024 14:00,1402/11/10,0,FQ,3,11.5,59.5,10.5,9.1,127,1.5,2024,1,2,133.5
15,1/30/2024 15:00,1402/11/10,0,FQ,3,11,60,10.5,9.1,127,1.5,2024,1,2,134.5
16,1/30/2024 16:00,1402/11/10,0,FQ,3,10,64.5,10.5,9.1,127.8,1.5,2024,1,2,134
5,1/31/2024 5:00,1402/11/11,0,FQ,3,9,71,10.5,9.1,128.7,1,2024,1,2,134
18,1/30/2024 18:00,1402/11/10,0,FQ,3,9,76,10.5,9.1,128.7,2.5,2024,1,2,134.5
19,1/30/2024 19:00,1402/11/10,0,FQ,3,8.5,77.5,10.5,9.1,127.2,2.5,2024,1,2,134.5
8,1/31/2024 8:00,1402/11/11,0,FQ,3,8.5,74,10.5,9.1,127.8,1,2024,1,2,116.0000003
21,1/30/2024 21:00,1402/11/10,0,FQ,3,10.5,55,10.5,9.1,123,2.5,2024,1,2,125.9999999
22,1/30/2024 22:00,1402/11/10,0,FQ,3,12.5,39.5,10.5,9.1,123,1.5,2024,1,2,126
11,1/31/2024 11:00,1402/11/11,0,FQ,3,14,40,10.5,9.1,127,1.5,2024,1,2,126.5
12,1/31/2024 12:00,1402/11/11,0,FQ,3,14.5,35.5,10.5,9.1,126.2,1.5,2024,2,3,116.0000002
13,1/31/2024 13:00,1402/11/11,0,FQ,3,13.5,38.5,10.5,9.1,126.2,1.5,2024,2,3,116
14,1/31/2024 14:00,1402/11/11,0,FQ,3,13.5,37.5,10.5,9.1,126.2,1.5,2024,2,3,116
3,2/1/2024 3:00,1402/11/12,0,FQ,3,14.5,37,10.5,9.1,126.2,1,2024,2,3,116
4,2/1/2024 4:00,1402/11/12,0,FQ,3,13.5,39.5,10.5,9.1,127,1,2024,2,3,116
5,2/1/2024 5:00,1402/11/12,0,FQ,3,12,48,10.5,9.1,127,1,2024,2,3,117
6,2/1/2024 6:00,1402/11/12,0,FQ,3,9.5,51,10.5,9.1,127,1,2024,2,3,117
7,2/1/2024 7:00,1402/11/12,0,FQ,3,8,51,10.5,9.1,127,1,2024,2,3,117
20,1/31/2024 20:00,1402/11/11,0,FQ,3,7.5,51,10.5,9.1,127.2,2.5,2024,2,3,117
21,1/31/2024 21:00,1402/11/11,0,FQ,3,11.5,40,10.5,9.1,123,2.5,2024,2,3,106.0000002
22,1/31/2024 22:00,1402/11/11,0,FQ,3,11,40.5,10.5,9.1,123,1.5,2024,2,3,116.9999998
23,1/31/2024 23:00,1402/11/11,0,FQ,3,11.5,39.5,10.5,9.1,123.8,1.5,2024,2,3,117
12,2/1/2024 12:00,1402/11/12,0,FQ,3,16,50,10.5,9.1,127,1.5,2024,2,4,56.00000091
1,2/2/2024 1:00,1402/11/13,0,FQ,3,16.5,49.5,10.5,9.1,125.3,1,2024,2,4,55.00000001
14,2/1/2024 14:00,1402/11/12,0,FQ,3,16.5,53,10.5,9.1,126.2,1.5,2024,2,4,55
3,2/2/2024 3:00,1402/11/13,0,FQ,3,16,47.5,10.5,9.1,126.2,1,2024,2,4,55
4,2/2/2024 4:00,1402/11/13,0,FQ,3,16,37.5,10.5,9.1,127,1,2024,2,4,55
17,2/1/2024 17:00,1402/11/12,0,FQ,3,15.5,37.5,10.5,9.1,127.8,1.5,2024,2,4,55
18,2/1/2024 18:00,1402/11/12,0,FQ,3,15,41.5,10.5,9.1,127.8,2.5,2024,2,4,55
7,2/2/2024 7:00,1402/11/13,0,FQ,3,13.5,62.5,10.5,9.1,127,1,2024,2,4,55
20,2/1/2024 20:00,1402/11/12,0,FQ,3,12.5,61.5,10.5,9.1,127.2,2.5,2024,2,4,4.500000753
9,2/2/2024 9:00,1402/11/13,0,FQ,3,12,50.5,10.5,9.1,128.7,1,2024,2,4,6.71E-08
10,2/2/2024 10:00,1402/11/13,0,FQ,3,12.5,49,10.5,9.1,127.8,1.5,2024,2,4,1.49E-23
23,2/1/2024 23:00,1402/11/12,0,FQ,3,13,41,10.5,9.1,123.8,1.5,2024,2,4,3.31E-39
12,2/2/2024 12:00,1402/11/13,0,FQ,3,8.5,54,10.5,9.1,127,1.5,2024,2,5,7.34E-55
13,2/2/2024 13:00,1402/11/13,0,FQ,3,8,57,10.5,9.1,126.2,1.5,2024,2,5,1.63E-70
14,2/2/2024 14:00,1402/11/13,0,FQ,3,8.5,51.5,10.5,9.1,126.2,1.5,2024,2,5,3.62E-86
15,2/2/2024 15:00,1402/11/13,0,FQ,3,7.5,57.5,10.5,9.1,126.2,1.5,2024,2,5,8.04E-102
16,2/2/2024 16:00,1402/11/13,0,FQ,3,7,62.5,10.5,9.1,126.2,1.5,2024,2,5,1.78E-117
5,2/3/2024 5:00,1402/11/14,0,FQ,3,5.5,71.5,10.5,9.1,135.3,1,2024,2,5,3.96E-133
6,2/3/2024 6:00,1402/11/14,0,FQ,3,4.5,83,10.5,9.1,135.3,1,2024,2,5,8.80E-149
7,2/3/2024 7:00,1402/11/14,0,FQ,3,4,83.5,10.5,9.1,133.7,1,2024,2,5,1.95E-164
8,2/3/2024 8:00,1402/11/14,0,FQ,3,4.5,77,10.5,9.1,132,1,2024,2,5,4.34E-180
21,2/2/2024 21:00,1402/11/13,0,FQ,3,5.5,64,10.5,9.1,123,2.5,2024,2,5,9.63E-196
22,2/2/2024 22:00,1402/11/13,0,FQ,3,7.5,46.5,10.5,9.1,123,1.5,2024,2,5,2.14E-211
11,2/3/2024 11:00,1402/11/14,0,FG3,3,7.5,45.5,10.5,9.1,127.8,1.5,2024,2,5,4.75E-227
12,2/3/2024 12:00,1402/11/14,0,FG3,3,7.5,38.5,10.5,9.1,127.8,1.5,2024,2,6,1.05E-242
13,2/3/2024 13:00,1402/11/14,0,FG3,3,7,43,10.5,9.1,127,1.5,2024,2,6,2.34E-258
14,2/3/2024 14:00,1402/11/14,0,FG3,3,8,38.5,10.5,9.1,127,1.5,2024,2,6,5.20E-274
3,2/4/2024 3:00,1402/11/15,0,FG3,3,7.5,45,10.5,9.1,134.5,1,2024,2,6,1.15E-289
16,2/3/2024 16:00,1402/11/14,0,FG3,3,7,51,10.5,9.1,127.8,1.5,2024,2,6,2.56E-305
5,2/4/2024 5:00,1402/11/15,0,FG3,3,6,59,10.5,9.1,135.3,1,2024,2,6,5.69e-321
18,2/3/2024 18:00,1402/11/14,0,FG3,3,3.5,66,10.5,9.1,130.3,2.5,2024,2,6,0
7,2/4/2024 7:00,1402/11/15,0,FG3,3,3,68.5,10.5,9.1,133.7,1,2024,2,6,0
8,2/4/2024 8:00,1402/11/15,0,FG3,3,3,68.5,10.5,9.1,132,1,2024,2,6,0
9,2/4/2024 9:00,1402/11/15,0,FG3,3,5.5,55.5,10.5,9.1,129.5,1,2024,2,6,0
10,2/4/2024 10:00,1402/11/15,0,FG3,3,7,32,10.5,9.1,128.7,1.5,2024,2,6,0
11,2/4/2024 11:00,1402/11/15,0,FG3,3,7.5,33,10.5,9.1,127.8,1.5,2024,2,6,0
24,2/4/2024 0:00,1402/11/15,0,FG3,3,8.5,31,10.5,9.1,131.3,1.5,2024,2,0,0
13,2/4/2024 13:00,1402/11/15,0,FG3,3,8,35.5,10.65,9.25,127,1.5,2024,2,0,0
2,2/5/2024 2:00,1402/11/16,0,FG3,3,7.5,32.5,10.65,9.25,132.8,1,2024,2,0,0
15,2/4/2024 15:00,1402/11/15,0,FG3,3,7.5,39.5,10.65,9.25,127,1.5,2024,2,0,0
16,2/4/2024 16:00,1402/11/15,0,FG3,3,7,44.5,10.65,9.25,127.8,1.5,2024,2,0,0
5,2/5/2024 5:00,1402/11/16,0,FG3,3,6,50,10.65,9.25,133.7,1,2024,2,0,0
18,2/4/2024 18:00,1402/11/15,0,FG3,3,3.5,56.5,10.65,9.25,130.3,2.5,2024,2,0,0
19,2/4/2024 19:00,1402/11/15,0,FG3,3,3.5,57,10.8,9.4,129.7,2.5,2024,2,0,0
20,2/4/2024 20:00,1402/11/15,0,FG3,3,3,58.5,10.8,9.4,130.5,2.5,2024,2,0,0
21,2/4/2024 21:00,1402/11/15,0,FG3,3,6.5,41.5,10.8,9.4,130.5,2.5,2024,2,0,0
10,2/5/2024 10:00,1402/11/16,0,FG3,3,6.5,28.5,10.8,9.4,128.7,1.5,2024,2,0,0
23,2/4/2024 23:00,1402/11/15,0,FG3,3,8,27.5,10.8,9.4,131.3,1.5,2024,2,0,0
12,2/5/2024 12:00,1402/11/16,0,FG3,3,8,30,10.8,9.4,127,1.5,2024,2,1,0
1,2/6/2024 1:00,1402/11/17,0,FG3,3,8.5,32.5,10.8,9.4,132,1,2024,2,1,0
2,2/6/2024 2:00,1402/11/17,0,FG3,3,9,32,10.8,9.4,132.8,1,2024,2,1,0
15,2/5/2024 15:00,1402/11/16,0,FG3,3,8.5,34,10.8,9.4,127,1.5,2024,2,1,0
16,2/5/2024 16:00,1402/11/16,0,FG3,3,7.5,38,10.8,9.4,127,1.5,2024,2,1,0
5,2/6/2024 5:00,1402/11/17,0,FG3,3,6.5,44.5,10.8,9.4,133.7,1,2024,2,1,0
18,2/5/2024 18:00,1402/11/16,0,FG3,3,4.5,51,10.8,9.4,127.8,2.5,2024,2,1,0
7,2/6/2024 7:00,1402/11/17,0,FG3,3,3,53.5,10.8,9.4,133.7,1,2024,2,1,0
8,2/6/2024 8:00,1402/11/17,0,FG3,3,3,53.5,10.8,9.4,132,1,2024,2,1,0
9,2/6/2024 9:00,1402/11/17,0,FG3,3,7,32.5,10.8,9.4,129.5,1,2024,2,1,0
10,2/6/2024 10:00,1402/11/17,0,FG3,3,7,28.5,10.8,9.4,128.7,1.5,2024,2,1,0
11,2/6/2024 11:00,1402/11/17,0,FG3,3,8,29,10.8,9.4,127.8,1.5,2024,2,1,0
12,2/6/2024 12:00,1402/11/17,0,FG3,3,10.5,27,10.8,9.4,127,1.5,2024,2,2,0
1,2/7/2024 1:00,1402/11/18,0,FG3,3,10,36.5,10.8,9.4,131.2,1,2024,2,2,0
2,2/7/2024 2:00,1402/11/18,0,FG3,3,10,38.5,10.8,9.4,132,1,2024,2,2,0
15,2/6/2024 15:00,1402/11/17,0,FG3,3,9,40.5,10.8,9.4,127,1.5,2024,2,2,0
16,2/6/2024 16:00,1402/11/17,0,FG3,3,9,45,10.8,9.4,127,1.5,2024,2,2,0
5,2/7/2024 5:00,1402/11/18,0,FG3,3,8,50,10.8,9.4,132.8,1,2024,2,2,0
18,2/6/2024 18:00,1402/11/17,0,FG3,3,6.5,54.5,10.8,9.4,127.8,2.5,2024,2,2,0
19,2/6/2024 19:00,1402/11/17,0,FG3,3,5,58.5,10.8,9.4,127.2,2.5,2024,2,2,0
8,2/7/2024 8:00,1402/11/18,0,FG3,3,6.5,58.5,10.8,9.4,131.2,1,2024,2,2,0
21,2/6/2024 21:00,1402/11/17,0,FG3,3,8,41,10.8,9.4,128,2.5,2024,2,2,0
22,2/6/2024 22:00,1402/11/17,0,FG3,3,8.5,32.5,10.8,9.4,128.8,1.5,2024,2,2,0
11,2/7/2024 11:00,1402/11/18,0,FG3,3,9.5,27.5,10.8,9.4,127.8,1.5,2024,2,2,0
12,2/7/2024 12:00,1402/11/18,0,FG3,3,10.5,36.5,10.8,9.4,127,1.5,2024,2,3,0
13,2/7/2024 13:00,1402/11/18,0,FG3,3,10.5,42.5,10.8,9.4,126.2,1.5,2024,2,3,0
14,2/7/2024 14:00,1402/11/18,0,FG3,3,10,41,10.8,9.4,126.2,1.5,2024,2,3,0
3,2/8/2024 3:00,1402/11/19,0,FG3,3,9.5,41,10.8,9.4,132,1,2024,2,3,0
16,2/7/2024 16:00,1402/11/18,0,FG3,3,9,50.5,10.8,9.4,126.2,1.5,2024,2,3,0
5,2/8/2024 5:00,1402/11/19,0,FG3,3,8.5,53.5,10.8,9.4,132.8,1,2024,2,3,0
6,2/8/2024 6:00,1402/11/19,0,FG3,3,6,63.5,10.8,9.4,132.8,1,2024,2,3,0
7,2/8/2024 7:00,1402/11/19,0,FG3,3,6,65,10.8,9.4,132.8,1,2024,2,3,0
8,2/8/2024 8:00,1402/11/19,0,FG3,3,6,64.5,10.8,9.4,131.2,1,2024,2,3,0
21,2/7/2024 21:00,1402/11/18,0,FG3,3,7.5,57,10.8,9.4,128,2.5,2024,2,3,0
22,2/7/2024 22:00,1402/11/18,0,FG3,3,9.5,33.5,10.8,9.4,128.8,1.5,2024,2,3,0
23,2/7/2024 23:00,1402/11/18,0,FG3,3,12,32.5,10.8,9.4,128.8,1.5,2024,2,3,0
12,2/8/2024 12:00,1402/11/19,0,FG3,3,11,40.5,10.8,9.4,127,1.5,2024,2,4,0
1,2/9/2024 1:00,1402/11/20,0,FG3,3,10.5,45,10.8,9.4,129.5,1,2024,2,4,0
2,2/9/2024 2:00,1402/11/20,0,FG3,3,10.5,41,10.8,9.4,130.3,1,2024,2,4,0
3,2/9/2024 3:00,1402/11/20,0,FG3,3,10,48,10.8,9.4,131.2,1,2024,2,4,0
4,2/9/2024 4:00,1402/11/20,0,FG3,3,10,52,10.8,9.4,132,1,2024,2,4,0
17,2/8/2024 17:00,1402/11/19,0,FG3,3,9,56.5,10.8,9.4,127.8,1.5,2024,2,4,0
6,2/9/2024 6:00,1402/11/20,0,FG3,3,7,62.5,10.8,9.4,132,1,2024,2,4,0
19,2/8/2024 19:00,1402/11/19,0,FG3,3,5,67,10.8,9.4,127.2,2.5,2024,2,4,0
20,2/8/2024 20:00,1402/11/19,0,FG3,3,7.5,61.5,10.8,9.4,128,2.5,2024,2,4,0
9,2/9/2024 9:00,1402/11/20,0,FG3,3,10,46,10.8,9.4,127,1,2024,2,4,0
10,2/9/2024 10:00,1402/11/20,0,FG3,3,11,31.5,10.8,9.4,125.3,1.5,2024,2,4,0
23,2/8/2024 23:00,1402/11/19,0,FG3,3,11,34,10.8,9.4,128.8,1.5,2024,2,4,0
12,2/9/2024 12:00,1402/11/20,0,FG3,3,11.5,39,10.8,9.4,124.5,1.5,2024,2,5,0
1,2/10/2024 1:00,1402/11/21,0,R,3,11.5,41.5,10.8,9.4,129.5,1,2024,2,5,0
14,2/9/2024 14:00,1402/11/20,0,FG3,3,11.5,37.5,10.8,9.4,127.8,1.5,2024,2,5,0
15,2/9/2024 15:00,1402/11/20,0,FG3,3,11.5,43,10.8,9.4,127.8,1.5,2024,2,5,0
16,2/9/2024 16:00,1402/11/20,0,FG3,3,11,48,10.8,9.4,128.7,1.5,2024,2,5,0
17,2/9/2024 17:00,1402/11/20,0,FG3,3,10,54.5,10.8,9.4,124.5,1.5,2024,2,5,0
18,2/9/2024 18:00,1402/11/20,0,R,3,8,58,10.8,9.4,125.3,2.5,2024,2,5,0
19,2/9/2024 19:00,1402/11/20,0,R,3,7,58,10.8,9.4,123.8,2.5,2024,2,5,0
20,2/9/2024 20:00,1402/11/20,0,R,3,8,57,10.8,9.4,124.7,2.5,2024,2,5,0
21,2/9/2024 21:00,1402/11/20,0,R,3,9.5,47.5,10.8,9.4,124.7,2.5,2024,2,5,0
10,2/10/2024 10:00,1402/11/21,0,R,3,12.5,31,10.8,9.4,125.3,1.5,2024,2,5,0
23,2/9/2024 23:00,1402/11/20,0,R,3,12.5,33.5,10.8,9.4,125.5,1.5,2024,2,5,0
24,2/10/2024 0:00,1402/11/21,0,R,3,13.5,29,10.8,9.4,126.3,1.5,2024,2,6,0
13,2/10/2024 13:00,1402/11/21,0,R,3,14.5,30.5,10.8,9.4,128.7,1.5,2024,2,6,0
2,2/11/2024 2:00,1402/11/22,0,R,3,14.5,27,10.8,9.4,127.8,1,2024,2,6,0
15,2/10/2024 15:00,1402/11/21,0,R,3,14.5,30.5,10.8,9.4,127.8,1.5,2024,2,6,0
16,2/10/2024 16:00,1402/11/21,0,R,3,14,34,10.8,9.4,128.7,1.5,2024,2,6,0
17,2/10/2024 17:00,1402/11/21,0,R,3,13,37.5,10.8,9.4,124.5,1.5,2024,2,6,0
18,2/10/2024 18:00,1402/11/21,62,SO,3,11,42.5,10.8,9.4,125.3,2.5,2024,2,6,0
19,2/10/2024 19:00,1402/11/21,62,SO,3,11,44,10.8,9.4,123.8,2.5,2024,2,6,0
8,2/11/2024 8:00,1402/11/22,64,R,3,11,41.5,10.8,9.4,127,1,2024,2,6,0
21,2/10/2024 21:00,1402/11/21,64,SO,3,11.5,35.5,10.55,9.2,124.7,2.5,2024,2,6,0
22,2/10/2024 22:00,1402/11/21,0,R,3,13,31.5,10.55,9.2,124.7,1.5,2024,2,6,0
23,2/10/2024 23:00,1402/11/21,0,R,3,13,26.5,10.55,9.2,125.5,1.5,2024,2,6,0
12,2/11/2024 12:00,1402/11/22,0,R,3,13.5,38,10.55,9.2,127.8,1.5,2024,2,0,0
13,2/11/2024 13:00,1402/11/22,0,R,3,14,40,10.3,9,127.8,1.5,2024,2,0,0
14,2/11/2024 14:00,1402/11/22,0,R,3,14,43,10.3,9,127.8,1.5,2024,2,0,0
15,2/11/2024 15:00,1402/11/22,0,R,3,13.5,46.5,10.35,9.1,127.8,1.5,2024,2,0,0
16,2/11/2024 16:00,1402/11/22,0,R,3,14,50,10.35,9.1,128.7,1.5,2024,2,0,0
5,2/12/2024 5:00,1402/11/23,18,R,3,12.5,51.5,10.35,9.1,128.7,1,2024,2,0,0
18,2/11/2024 18:00,1402/11/22,64,SO,3,11,54,10.35,9.1,125.3,2.5,2024,2,0,0
7,2/12/2024 7:00,1402/11/23,62.5,R,3,10,56.5,10.35,9.1,127.8,1,2024,2,0,0
20,2/11/2024 20:00,1402/11/22,125.5,SO,3,10.5,55,10.35,9.1,125.5,2.5,2024,2,0,0
21,2/11/2024 21:00,1402/11/22,125.5,SO,3,11.5,46,10.35,9.1,125.5,2.5,2024,2,0,0
22,2/11/2024 22:00,1402/11/22,61,SO,3,13.5,33.5,10.35,9.1,126.3,1.5,2024,2,0,0
11,2/12/2024 11:00,1402/11/23,22.5,LA,3,13.5,37,10.05,8.2,128.7,1.5,2024,2,0,0
12,2/12/2024 12:00,1402/11/23,86,LA,3,13,40.5,10.05,8.2,127.8,1.5,2024,2,1,0
13,2/12/2024 13:00,1402/11/23,98.5,LA,3,13.5,42,9.9,8.3,127.8,1.5,2024,2,1,0
2,2/13/2024 2:00,1402/11/24,113.5,SO,3,14,40,9.9,8.3,127.8,1,2024,2,1,0
15,2/12/2024 15:00,1402/11/23,118,SO,3,14,44.5,9.85,8.9,127.8,1.5,2024,2,1,0
16,2/12/2024 16:00,1402/11/23,118.5,SO,3,13,50,9.85,8.9,128.7,1.5,2024,2,1,0
17,2/12/2024 17:00,1402/11/23,103.5,SO,3,12,55.5,9.85,8.9,125.3,1.5,2024,2,1,0
18,2/12/2024 18:00,1402/11/23,120.5,SO,3,10,61.5,9.85,8.9,125.3,2.5,2024,2,1,0
19,2/12/2024 19:00,1402/11/23,122,SO,3,9.5,63.5,10.15,9.1,124.7,2.5,2024,2,1,0
20,2/12/2024 20:00,1402/11/23,122.5,SO,3,11.5,61,10.15,9.1,125.5,2.5,2024,2,1,0
9,2/13/2024 9:00,1402/11/24,121.5,SO,3,13,47,10.15,9.1,127,1,2024,2,1,0
22,2/12/2024 22:00,1402/11/23,120.5,SO,3,14.5,37,10.15,9.1,126.3,1.5,2024,2,1,0
23,2/12/2024 23:00,1402/11/23,121.5,SO,3,14,33,10.35,9.15,126.3,1.5,2024,2,1,0
12,2/13/2024 12:00,1402/11/24,121.5,SO,3,15,34,10.35,9.15,123.6,1.5,2024,2,2,0
13,2/13/2024 13:00,1402/11/24,120,SO,3,15.5,32.5,10.65,9.15,122.8,1.5,2024,2,2,0
14,2/13/2024 14:00,1402/11/24,120,SO,3,15.5,29,10.65,9.15,122.8,1.5,2024,2,2,0
15,2/13/2024 15:00,1402/11/24,120,SO,3,14.5,32,10.4,9.15,122.8,1.5,2024,2,2,0
16,2/13/2024 16:00,1402/11/24,122,SO,3,14.5,37,10.4,9.15,124.5,1.5,2024,2,2,0
5,2/14/2024 5:00,1402/11/25,122,SO,3,13,45,10.4,9.15,127,1,2024,2,2,0
6,2/14/2024 6:00,1402/11/25,122.5,SO,3,10.5,51.5,10.4,9.15,127,1,2024,2,2,61.99999908
19,2/13/2024 19:00,1402/11/24,122.5,SO,3,10,52,10.4,9.2,124.7,2.5,2024,2,2,62
8,2/14/2024 8:00,1402/11/25,122.5,SO,3,12,47,10.4,9.2,128.7,1,2024,2,2,63.99999997
9,2/14/2024 9:00,1402/11/25,122.5,SO,3,15,38.5,10.4,9.2,126.2,1,2024,2,2,64
22,2/13/2024 22:00,1402/11/24,122.5,SO,3,14,26.5,10.4,9.2,126.3,1.5,2024,2,2,9.54E-07
23,2/13/2024 23:00,1402/11/24,119,SO,3,15.5,25.5,10.4,9,126.3,1.5,2024,2,2,2.12E-22
24,2/14/2024 0:00,1402/11/25,118.5,SO,3,16,46.5,10.4,9,127.2,1.5,2024,2,3,4.70E-38
13,2/14/2024 13:00,1402/11/25,118.5,LG3,3,16.5,47,10.1,8.9,122.8,1.5,2024,2,3,1.04E-53
14,2/14/2024 14:00,1402/11/25,118.5,LG3,3,16,46.5,10.1,8.9,122,1.5,2024,2,3,2.32E-69
3,2/15/2024 3:00,1402/11/26,118.5,SO,3,16.5,48,10.1,8.8,126.2,1,2024,2,3,5.15E-85
16,2/14/2024 16:00,1402/11/25,116,LG3,3,16,45,10.1,8.8,122.8,1.5,2024,2,3,1.14E-100
17,2/14/2024 17:00,1402/11/25,116,LG3,3,15.5,52,10.1,8.8,124.5,1.5,2024,2,3,17.99999973
18,2/14/2024 18:00,1402/11/25,116,SO,3,13.5,58.5,10.1,8.8,125.3,2.5,2024,2,3,63.99999931
19,2/14/2024 19:00,1402/11/25,118.5,SO,3,13.5,61,10.7,9.15,124.7,2.5,2024,2,3,62.50000002
8,2/15/2024 8:00,1402/11/26,126,SO,3,14,58,10.7,9.15,128.7,1,2024,2,3,125.4999991
9,2/15/2024 9:00,1402/11/26,124,SO,3,15,51,10.7,9.15,126.2,1,2024,2,3,125.5
22,2/14/2024 22:00,1402/11/25,122.5,SO,3,17,40.5,10.7,9.15,126.3,1.5,2024,2,3,61.00000096
11,2/15/2024 11:00,1402/11/26,122.5,SO,3,16,42,10.2,9,124.5,1.5,2024,2,3,22.50000057
24,2/15/2024 0:00,1402/11/26,120.5,SO,3,19,41.5,10.2,9,127.2,1.5,2024,2,4,85.99999905
1,2/16/2024 1:00,1402/11/27,119,SO,3,20,42.5,10.45,9.15,124.5,1,2024,2,4,98.49999981
14,2/15/2024 14:00,1402/11/26,120.5,SO,3,19.5,51.5,10.45,9.15,122,1.5,2024,2,4,113.4999998
15,2/15/2024 15:00,1402/11/26,120.5,SO,3,19,51.5,10.3,9,122,1.5,2024,2,4,117.9999999
16,2/15/2024 16:00,1402/11/26,121,SO,3,19,51,10.3,9,122.8,1.5,2024,2,4,118.5
17,2/15/2024 17:00,1402/11/26,121,SO,3,18.5,52.5,10.3,9,124.5,1.5,2024,2,4,103.5000002
6,2/16/2024 6:00,1402/11/27,120.5,SO,3,18,54,10.3,9,127,1,2024,2,4,120.4999997
19,2/15/2024 19:00,1402/11/26,120,SO,3,17.5,59,10.55,9.25,124.7,2.5,2024,2,4,122
20,2/15/2024 20:00,1402/11/26,119,SO,3,17,59,10.55,9.25,124.7,2.5,2024,2,4,122.5
21,2/15/2024 21:00,1402/11/26,119.5,SO,3,15.5,65,10.55,9.25,125.5,2.5,2024,2,4,121.5
22,2/15/2024 22:00,1402/11/26,119.5,SO,3,17,36.5,10.55,9.25,126.3,1.5,2024,2,4,120.5
23,2/15/2024 23:00,1402/11/26,118,SO,3,18,40.5,10.6,9.35,126.3,1.5,2024,2,4,121.5
12,2/16/2024 12:00,1402/11/27,123,SO,3,19,63,10.6,9.35,123.6,1.5,2024,2,5,121.5
13,2/16/2024 13:00,1402/11/27,117.5,SO,3,19.5,75,10.6,9.2,122.8,1.5,2024,2,5,120
14,2/16/2024 14:00,1402/11/27,119.5,SO,3,18.5,79.5,10.6,9.2,122,1.5,2024,2,5,120
15,2/16/2024 15:00,1402/11/27,119,SO,3,18.5,75.5,10.65,9.05,122,1.5,2024,2,5,120
16,2/16/2024 16:00,1402/11/27,119,SO,3,18.5,80,10.65,9.05,122.8,1.5,2024,2,5,122
5,2/17/2024 5:00,1402/11/28,118,SO,3,18,83.5,10.65,9.05,126.2,1,2024,2,5,122
18,2/16/2024 18:00,1402/11/27,117.5,SO,3,18,80.5,10.65,9.05,125.3,2.5,2024,2,5,122.5
19,2/16/2024 19:00,1402/11/27,116.5,SO,3,17.5,77.5,10,8.85,124.7,2.5,2024,2,5,122.5
20,2/16/2024 20:00,1402/11/27,117.5,SO,3,17,77.5,10,8.85,124.7,2.5,2024,2,5,122.5
21,2/16/2024 21:00,1402/11/27,119.5,SO,3,18,76.5,10,8.85,125.5,2.5,2024,2,5,122.5
22,2/16/2024 22:00,1402/11/27,115,SO,3,18,84,10,8.85,126.3,1.5,2024,2,5,122.5
23,2/16/2024 23:00,1402/11/27,127.5,SO,3,18,82.5,10.75,9.1,126.3,1.5,2024,2,5,119.0000001
12,2/17/2024 12:00,1402/11/28,131,LF1,3,17,66.5,10.75,9.1,126.2,1.5,2024,2,6,118.5
13,2/17/2024 13:00,1402/11/28,130.5,LF1,3,17,70,10.95,9.3,125.3,1.5,2024,2,6,118.5
14,2/17/2024 14:00,1402/11/28,129.5,LF1,3,17,63.5,10.95,9.3,125.3,1.5,2024,2,6,118.5
15,2/17/2024 15:00,1402/11/28,129.5,LF1,3,16.5,70.5,10.95,9.2,126.2,1.5,2024,2,6,118.5
4,2/18/2024 4:00,1402/11/29,129.5,LF1,3,16,69.5,10.95,9.2,125.3,1,2024,2,6,116
17,2/17/2024 17:00,1402/11/28,130.5,LF1,3,14.5,77.5,10.95,9.2,127.8,1.5,2024,2,6,116
6,2/18/2024 6:00,1402/11/29,131,LF1,3,14,78,10.95,9.2,125.3,1,2024,2,6,116
19,2/17/2024 19:00,1402/11/28,132,LF1,3,13.5,78.5,10.6,9.3,127.2,2.5,2024,2,6,118.5
20,2/17/2024 20:00,1402/11/28,132.5,LF1,3,13.5,80,10.6,9.3,127.2,2.5,2024,2,6,125.9999999
9,2/18/2024 9:00,1402/11/29,131.5,LF1,3,15,64.5,10.6,9.3,128.7,1,2024,2,6,124
10,2/18/2024 10:00,1402/11/29,132,LF1,3,15.5,43.5,10.6,9.3,127.8,1.5,2024,2,6,122.5
23,2/17/2024 23:00,1402/11/28,131.5,LF1,3,15.5,41.5,10.8,9.4,123,1.5,2024,2,6,122.5
12,2/18/2024 12:00,1402/11/29,133.5,LF1,3,12,42,10.8,9.4,127,1.5,2024,2,0,120.5
1,2/19/2024 1:00,1402/11/30,134,LF1,3,11.5,44.5,10.5,9.3,128.7,1,2024,2,0,119
14,2/18/2024 14:00,1402/11/29,134,LF1,3,11.5,48,10.5,9.3,127,1.5,2024,2,0,120.5
3,2/19/2024 3:00,1402/11/30,135,LF1,3,10.5,53.5,10.65,9.4,129.5,1,2024,2,0,120.5
16,2/18/2024 16:00,1402/11/29,135,LF1,3,10.5,56.5,10.65,9.4,127,1.5,2024,2,0,121
17,2/18/2024 17:00,1402/11/29,135,LF1,3,10,58,10.65,9.4,127.8,1.5,2024,2,0,121
18,2/18/2024 18:00,1402/11/29,135,LF1,3,8,67.5,10.65,9.4,127.8,2.5,2024,2,0,120.5
19,2/18/2024 19:00,1402/11/29,134.5,LF1,3,7,70,10.35,9.3,127.2,2.5,2024,2,0,120
8,2/19/2024 8:00,1402/11/30,134,LF1,3,8.5,68.5,10.35,9.3,127,1,2024,2,0,119
21,2/18/2024 21:00,1402/11/29,132.5,LF1,3,10.5,53.5,10.35,9.3,127.2,2.5,2024,2,0,119.5
22,2/18/2024 22:00,1402/11/29,133.5,LF1,3,9.5,55.5,10.35,9.3,123,1.5,2024,2,0,119.5
11,2/19/2024 11:00,1402/11/30,132,LF1,3,11,43,10.35,9.3,128.7,1.5,2024,2,0,118
12,2/19/2024 12:00,1402/11/30,131,LF1,3,11.5,50.5,10.35,9.3,128.7,1.5,2024,2,1,122.9999999
1,2/20/2024 1:00,1402/12/01,130,LF1,3,12.5,51,10.4,9.35,132,1,2024,2,1,117.5000001
14,2/19/2024 14:00,1402/11/30,107.5,LF1,3,11.5,49.5,10.4,9.35,128.7,1.5,2024,2,1,119.5
3,2/20/2024 3:00,1402/12/01,124,LF1,3,11.5,50,10.25,9.1,132.8,1,2024,2,1,119
16,2/19/2024 16:00,1402/11/30,124.5,LF1,3,11,57.5,10.25,9.1,124.5,1.5,2024,2,1,119
17,2/19/2024 17:00,1402/11/30,125.5,LF1,3,10,61,10.25,9.1,124.5,1.5,2024,2,1,118
18,2/19/2024 18:00,1402/11/30,125.5,LF1,3,8.5,65.5,10.25,9.1,124.5,2.5,2024,2,1,117.5
19,2/19/2024 19:00,1402/11/30,126,LF1,3,7.5,67,10.1,9.15,123.8,2.5,2024,2,1,116.5
20,2/19/2024 20:00,1402/11/30,128,LF1,3,8,70.5,10.1,9.15,123.8,2.5,2024,2,1,117.5
9,2/20/2024 9:00,1402/12/01,128.5,LF1,3,10,57,10.1,9.15,129.5,1,2024,2,1,119.5
22,2/19/2024 22:00,1402/11/30,129,LF1,3,11,44.5,10.1,9.15,124.7,1.5,2024,2,1,115.0000001
23,2/19/2024 23:00,1402/11/30,131,LF1,3,11.5,50,10.35,9.25,125.5,1.5,2024,2,1,127.4999998
12,2/20/2024 12:00,1402/12/01,131,LF1,3,11,44.5,10.35,9.25,127,1.5,2024,2,2,130.9999999
13,2/20/2024 13:00,1402/12/01,129.5,LF1,3,12,41,10.4,9.2,127,1.5,2024,2,2,130.5
14,2/20/2024 14:00,1402/12/01,130,LF1,3,12,42.5,10.4,9.2,127,1.5,2024,2,2,129.5
3,2/21/2024 3:00,1402/12/02,130,SO,3,11,43.5,10.4,9.25,132.8,1,2024,2,2,129.5
4,2/21/2024 4:00,1402/12/02,129.5,SO,3,10.5,43,10.4,9.25,133.7,1,2024,2,2,129.5
5,2/21/2024 5:00,1402/12/02,130,SO,3,10,43,10.4,9.25,133.7,1,2024,2,2,130.5
6,2/21/2024 6:00,1402/12/02,130.5,SO,3,8.5,63,10.4,9.25,133.7,1,2024,2,2,131
19,2/20/2024 19:00,1402/12/01,133,SO,3,7.5,65,10.35,9.25,127.2,2.5,2024,2,2,132
20,2/20/2024 20:00,1402/12/01,129,SO,3,8.5,68.5,10.35,9.25,128,2.5,2024,2,2,132.5
21,2/20/2024 21:00,1402/12/01,113,SO,3,11,50.5,10.35,9.25,128,2.5,2024,2,2,131.5
10,2/21/2024 10:00,1402/12/02,127,SO,3,12,38.5,10.35,9.25,128.7,1.5,2024,2,2,132
11,2/21/2024 11:00,1402/12/02,126,SO,3,12,44.5,10.5,9.25,127.8,1.5,2024,2,2,131.5
12,2/21/2024 12:00,1402/12/02,121,SO,3,13.5,38.5,10.5,9.25,127,1.5,2024,2,3,133.5
1,2/22/2024 1:00,1402/12/03,121,SO,3,12.5,40.5,10.45,9.2,132,1,2024,2,3,134
14,2/21/2024 14:00,1402/12/02,121,SO,3,12.5,43.5,10.45,9.2,127,1.5,2024,2,3,134
15,2/21/2024 15:00,1402/12/02,121,SO,3,12,43,10.3,9.2,127,1.5,2024,2,3,135
16,2/21/2024 16:00,1402/12/02,121.5,SO,3,12,46,10.3,9.2,127,1.5,2024,2,3,135
17,2/21/2024 17:00,1402/12/02,121.5,SO,3,10.5,49,10.3,9.2,127.8,1.5,2024,2,3,135
6,2/22/2024 6:00,1402/12/03,121.5,SO,3,8,53,10.3,9.2,133.7,1,2024,2,3,135
19,2/21/2024 19:00,1402/12/02,121.5,SO,3,7.5,62,10.5,9.3,127.2,2.5,2024,2,3,134.5
20,2/21/2024 20:00,1402/12/02,121.5,SO,3,10.5,61.5,10.5,9.3,128,2.5,2024,2,3,134
21,2/21/2024 21:00,1402/12/02,126,SO,3,10,51,10.5,9.3,128,2.5,2024,2,3,132.5
22,2/21/2024 22:00,1402/12/02,125,SO,3,12,38,10.5,9.3,128.8,1.5,2024,2,3,133.5
11,2/22/2024 11:00,1402/12/03,126.5,LF1,3,12,45,10.55,9.25,127.8,1.5,2024,2,3,132
24,2/22/2024 0:00,1402/12/03,131,SO,3,11,42,10.55,9.25,129.7,1.5,2024,2,4,131
13,2/22/2024 13:00,1402/12/03,119.5,LF1,3,11.5,43.5,10.3,9.25,127,1.5,2024,2,4,130
14,2/22/2024 14:00,1402/12/03,119,LF1,3,11.5,42,10.3,9.25,127,1.5,2024,2,4,107.5000003
15,2/22/2024 15:00,1402/12/03,119,LF1,3,11.5,47,10.1,9.1,127,1.5,2024,2,4,123.9999998
16,2/22/2024 16:00,1402/12/03,119,LF1,3,11,50.5,10.1,9.1,127,1.5,2024,2,4,124.5
5,2/23/2024 5:00,1402/12/04,119,SO,3,10.5,58,10.1,9.1,127.8,1,2024,2,4,125.5
18,2/22/2024 18:00,1402/12/03,65,SO,3,8.5,63,10.1,9.1,127.8,2.5,2024,2,4,125.5
19,2/22/2024 19:00,1402/12/03,120.5,SO,3,7,66,9.6,8.8,127.2,2.5,2024,2,4,126
20,2/22/2024 20:00,1402/12/03,122,SO,3,8.5,65,9.6,8.8,128,2.5,2024,2,4,128
9,2/23/2024 9:00,1402/12/04,122,SO,3,10,60.5,9.6,8.8,127.8,1,2024,2,4,128.5
10,2/23/2024 10:00,1402/12/04,123.5,SO,3,11.5,55,9.6,8.8,127,1.5,2024,2,4,129
11,2/23/2024 11:00,1402/12/04,128,SO,3,12.5,38,9.6,8.8,127,1.5,2024,2,4,131
12,2/23/2024 12:00,1402/12/04,128.5,SO,3,15.5,24.5,9.6,8.8,126.2,1.5,2024,2,5,131
1,2/24/2024 1:00,1402/12/05,128.5,LF1,3,15.5,25.5,9.95,8.95,126.2,1,2024,2,5,129.5
14,2/23/2024 14:00,1402/12/04,126.5,LF1,3,15,27,9.95,8.95,125.3,1.5,2024,2,5,130
15,2/23/2024 15:00,1402/12/04,126.5,LF1,3,15.5,31,10.1,9,125.3,1.5,2024,2,5,130
4,2/24/2024 4:00,1402/12/05,126,LF1,3,15,33,10.1,9,127,1,2024,2,5,129.5
17,2/23/2024 17:00,1402/12/04,106,LF1,3,13.5,42,10.1,9,127,1.5,2024,2,5,130
18,2/23/2024 18:00,1402/12/04,106.5,LF1,3,12,45,10.1,9,127.8,2.5,2024,2,5,130.5
19,2/23/2024 19:00,1402/12/04,107,LF1,3,11,45,9.8,8.65,126.3,2.5,2024,2,5,133
20,2/23/2024 20:00,1402/12/04,110,LF1,3,12,42.5,9.8,8.65,127.2,2.5,2024,2,5,129.0000001
21,2/23/2024 21:00,1402/12/04,125.5,LF1,3,13,38.5,9.8,8.65,127.2,2.5,2024,2,5,113.0000002
10,2/24/2024 10:00,1402/12/05,125.5,LF1,3,13,38,9.8,8.65,127,1.5,2024,2,5,126.9999998
23,2/23/2024 23:00,1402/12/04,126,LF1,3,13,46.5,10.75,9.3,123,1.5,2024,2,5,126
12,2/24/2024 12:00,1402/12/05,95.5,SO,3,13,71.5,10.75,9.3,126.2,1.5,2024,2,6,121.0000001
13,2/24/2024 13:00,1402/12/05,68,SO,3,13,75.5,8.45,7.7,125.3,1.5,2024,2,6,121
2,2/25/2024 2:00,1402/12/06,59,FQ,3,14,66.5,8.45,7.7,126.2,1,2024,2,6,121
3,2/25/2024 3:00,1402/12/06,59,FQ,3,14,69.5,8.35,7.65,126.2,1,2024,2,6,121
16,2/24/2024 16:00,1402/12/05,59,SO,3,13.5,69,8.35,7.65,125.3,1.5,2024,2,6,121.5
17,2/24/2024 17:00,1402/12/05,59,SO,3,13,74.5,8.35,7.65,127,1.5,2024,2,6,121.5
6,2/25/2024 6:00,1402/12/06,60,FQ,3,12.5,75.5,8.35,7.65,127.8,1,2024,2,6,121.5
19,2/24/2024 19:00,1402/12/05,65.5,LF1,3,12.5,77,8.5,7.8,126.3,2.5,2024,2,6,121.5
20,2/24/2024 20:00,1402/12/05,66,LF1,3,12.5,82.5,8.5,7.8,127.2,2.5,2024,2,6,121.5
9,2/25/2024 9:00,1402/12/06,66.5,FQ,3,12.5,86.5,8.5,7.8,127.8,1,2024,2,6,125.9999999
22,2/24/2024 22:00,1402/12/05,65.5,LF1,3,11.5,95,8.5,7.8,127.2,1.5,2024,2,6,125
23,2/24/2024 23:00,1402/12/05,66,LF1,3,12.5,96,6,6.2,123,1.5,2024,2,6,126.5
12,2/25/2024 12:00,1402/12/06,0,FQ,3,10,91,6,6.2,126.2,1.5,2024,2,0,130.9999999
13,2/25/2024 13:00,1402/12/06,0,FQ,3,10,89.5,6,6.2,125.3,1.5,2024,2,0,119.5000002
14,2/25/2024 14:00,1402/12/06,0,FQ,3,11,82.5,6,6.2,125.3,1.5,2024,2,0,119
15,2/25/2024 15:00,1402/12/06,0,FQ,3,11.5,83,6,6.2,125.3,1.5,2024,2,0,119
4,2/26/2024 4:00,1402/12/07,0,FQ,3,11.5,82,6,6.2,129.5,1,2024,2,0,119
17,2/25/2024 17:00,1402/12/06,0,FQ,3,11.5,85.5,6,6.2,127,1.5,2024,2,0,119
18,2/25/2024 18:00,1402/12/06,0,FQ,3,9.5,85.5,6,6.2,127.8,2.5,2024,2,0,65.0000008
19,2/25/2024 19:00,1402/12/06,0,FQ,3,9,87.5,6,6.2,126.3,2.5,2024,2,0,120.4999992
20,2/25/2024 20:00,1402/12/06,0,FQ,3,10,82.5,6,6.2,127.2,2.5,2024,2,0,122
21,2/25/2024 21:00,1402/12/06,0,FQ,3,10,71,6,6.2,127.2,2.5,2024,2,0,122
10,2/26/2024 10:00,1402/12/07,0,FQ,3,10,71.5,6,6.2,125.3,1.5,2024,2,0,123.5
23,2/25/2024 23:00,1402/12/06,0,FQ,3,10,72.5,6,6.2,123,1.5,2024,2,0,127.9999999
12,2/26/2024 12:00,1402/12/07,0,FQ,3,12,56.5,6,6.2,128.7,1.5,2024,2,1,128.5
13,2/26/2024 13:00,1402/12/07,0,FQ,3,12,61,6,6.2,128.7,1.5,2024,2,1,128.5
14,2/26/2024 14:00,1402/12/07,0,FQ,3,12,60,6,6.2,128.7,1.5,2024,2,1,126.5
15,2/26/2024 15:00,1402/12/07,0,FQ,3,11.5,63.5,6,6.2,124.5,1.5,2024,2,1,126.5
4,2/27/2024 4:00,1402/12/08,0,FQ,3,11,68,6,6.2,129.5,1,2024,2,1,126
17,2/26/2024 17:00,1402/12/07,0,FQ,3,10,73.5,6,6.2,125.3,1.5,2024,2,1,106.0000003
18,2/26/2024 18:00,1402/12/07,0,FQ,3,8.5,80.5,6,6.2,126.2,2.5,2024,2,1,106.5
19,2/26/2024 19:00,1402/12/07,0,FQ,3,8,85,6,6.2,124.7,2.5,2024,2,1,107
20,2/26/2024 20:00,1402/12/07,0,FQ,3,9,82,6,6.2,124.7,2.5,2024,2,1,110
21,2/26/2024 21:00,1402/12/07,0,FQ,3,9.5,66,6,6.2,125.5,2.5,2024,2,1,125.4999998
10,2/27/2024 10:00,1402/12/08,0,FQ,3,12,50.5,6,6.2,125.3,1.5,2024,2,1,125.5
23,2/26/2024 23:00,1402/12/07,0,FQ,3,12,60,6,6.2,125.5,1.5,2024,2,1,126
12,2/27/2024 12:00,1402/12/08,0,FQ,3,11.5,50,6,6.2,128.7,1.5,2024,2,2,95.50000045
13,2/27/2024 13:00,1402/12/08,0,FQ,3,11.5,55.5,6,6.2,128.7,1.5,2024,2,2,68.00000041
14,2/27/2024 14:00,1402/12/08,0,FQ,3,11.5,51,6,6.2,128.7,1.5,2024,2,2,59.00000013
15,2/27/2024 15:00,1402/12/08,0,FQ,3,11.5,54,6,6.2,124.5,1.5,2024,2,2,59
4,2/28/2024 4:00,1402/12/09,0,FQ,3,12.5,53,6,6.2,129.5,1,2024,2,2,59
17,2/27/2024 17:00,1402/12/08,0,FQ,3,12,53,6,6.2,125.3,1.5,2024,2,2,59
18,2/27/2024 18:00,1402/12/08,0,FQ,3,10.5,66.5,6,6.2,126.2,2.5,2024,2,2,59.99999999
19,2/27/2024 19:00,1402/12/08,0,FQ,3,10.5,61.5,6,6.2,124.7,2.5,2024,2,2,65.49999992
20,2/27/2024 20:00,1402/12/08,0,FQ,3,10,61.5,6,6.2,124.7,2.5,2024,2,2,65.99999999
9,2/28/2024 9:00,1402/12/09,0,FQ,3,10,58,6,6.2,126.2,1,2024,2,2,66.49999999
10,2/28/2024 10:00,1402/12/09,0,FQ,3,9,69,6,6.2,125.3,1.5,2024,2,2,65.50000001
11,2/28/2024 11:00,1402/12/09,0,FQ,3,9,62.5,6,6.2,124.5,1.5,2024,2,2,65.99999999
24,2/28/2024 0:00,1402/12/09,0,FQ,3,8.5,71,6,6.2,126.3,1.5,2024,2,3,9.83E-07
13,2/28/2024 13:00,1402/12/09,0,FQ,3,8.5,77,8.15,7.65,128.7,1.5,2024,2,3,2.18E-22
2,2/29/2024 2:00,1402/12/10,0,FQ,3,9,79,8.15,7.65,130.3,1,2024,2,3,4.85E-38
15,2/28/2024 15:00,1402/12/09,0,FQ,3,8.5,79.5,8.15,7.65,124.5,1.5,2024,2,3,1.08E-53
4,2/29/2024 4:00,1402/12/10,0,FQ,3,8.5,79,8.15,7.65,131.2,1,2024,2,3,2.39E-69
5,2/29/2024 5:00,1402/12/10,0,FQ,3,8,80,8.15,7.65,131.2,1,2024,2,3,5.31E-85
6,2/29/2024 6:00,1402/12/10,0,FQ,3,7,83.5,8.15,7.65,131.2,1,2024,2,3,1.18E-100
19,2/28/2024 19:00,1402/12/09,0,FQ,3,6.5,88,8.15,7.65,124.7,2.5,2024,2,3,2.62E-116
20,2/28/2024 20:00,1402/12/09,0,FQ,3,7,82,8.15,7.65,124.7,2.5,2024,2,3,5.81E-132
21,2/28/2024 21:00,1402/12/09,0,FQ,3,7.5,67.5,8.15,7.65,125.5,2.5,2024,2,3,1.29E-147
22,2/28/2024 22:00,1402/12/09,0,FQ,3,8.5,53.5,8.15,7.65,125.5,1.5,2024,2,3,2.87E-163
23,2/28/2024 23:00,1402/12/09,0,FQ,3,9,53.5,10.3,9.1,125.5,1.5,2024,2,3,6.36E-179
24,2/29/2024 0:00,1402/12/10,0,FQ,3,8,43.5,10.3,9.1,128,1.5,2024,3,4,1.41E-194
1,3/1/2024 1:00,1402/12/11,0,FQ,3,8,47,10.3,9.1,130.3,1,2024,3,4,3.14E-210
14,2/29/2024 14:00,1402/12/10,0,FQ,3,8.5,40.5,10.3,9.1,126.2,1.5,2024,3,4,6.97E-226
15,2/29/2024 15:00,1402/12/10,0,FQ,3,7.5,45.5,10.3,9.1,127,1.5,2024,3,4,1.55E-241
16,2/29/2024 16:00,1402/12/10,0,FQ,3,6.5,49.5,10.3,9.1,127,1.5,2024,3,4,3.43E-257
17,2/29/2024 17:00,1402/12/10,0,FQ,3,6,52.5,10.3,9.1,127.8,1.5,2024,3,4,7.63E-273
18,2/29/2024 18:00,1402/12/10,0,FQ,3,4.5,55.5,10.3,9.1,127.8,2.5,2024,3,4,1.69E-288
19,2/29/2024 19:00,1402/12/10,0,FQ,3,5,57.5,10.3,9.1,126.3,2.5,2024,3,4,3.76E-304
20,2/29/2024 20:00,1402/12/10,0,FQ,3,6,60.5,10.3,9.1,126.3,2.5,2024,3,4,8.3477e-320
9,3/1/2024 9:00,1402/12/11,0,FQ,3,7.5,43,10.3,9.1,128.7,1,2024,3,4,0
22,2/29/2024 22:00,1402/12/10,0,FQ,3,7.5,41,10.3,9.1,126.3,1.5,2024,3,4,0
11,3/1/2024 11:00,1402/12/11,0,FQ,3,9,39.5,10.3,9.1,126.2,1.5,2024,3,4,0
12,3/1/2024 12:00,1402/12/11,0,FQ,3,9,36.5,10.3,9.1,126.2,1.5,2024,3,5,0
13,3/1/2024 13:00,1402/12/11,0,FQ,3,9,36.5,10.3,9.1,126.2,1.5,2024,3,5,0
14,3/1/2024 14:00,1402/12/11,0,FQ,3,9,34.5,10.3,9.1,126.2,1.5,2024,3,5,0
15,3/1/2024 15:00,1402/12/11,0,FQ,3,8,37.5,10.3,9.1,127,1.5,2024,3,5,0
16,3/1/2024 16:00,1402/12/11,0,FQ,3,8.5,41.5,10.3,9.1,127,1.5,2024,3,5,0
17,3/1/2024 17:00,1402/12/11,0,FQ,3,8,42.5,10.3,9.1,127.8,1.5,2024,3,5,0
18,3/1/2024 18:00,1402/12/11,0,FQ,3,6,43,10.3,9.1,127.8,2.5,2024,3,5,0
7,3/2/2024 7:00,1402/12/12,0,FQ,3,4.5,53,10.3,9.1,131.2,1,2024,3,5,0
20,3/1/2024 20:00,1402/12/11,0,FQ,3,7,39.5,10.3,9.1,126.3,2.5,2024,3,5,0
9,3/2/2024 9:00,1402/12/12,0,FQ,3,8,43,10.3,9.1,128.7,1,2024,3,5,0
22,3/1/2024 22:00,1402/12/11,0,FQ,3,10,40,10.3,9.1,126.3,1.5,2024,3,5,0
11,3/2/2024 11:00,1402/12/12,0,FQ,3,9.5,39,10.3,9.1,126.2,1.5,2024,3,5,0
12,3/2/2024 12:00,1402/12/12,0,FQ,3,10.5,36,10.3,9.1,126.2,1.5,2024,3,6,0
13,3/2/2024 13:00,1402/12/12,0,FQ,3,10,37.5,10.3,9.1,126.2,1.5,2024,3,6,0
14,3/2/2024 14:00,1402/12/12,0,FQ,3,9.5,37.5,10.3,9.1,126.2,1.5,2024,3,6,0
15,3/2/2024 15:00,1402/12/12,0,FQ,3,9,39,10.3,9.1,127,1.5,2024,3,6,0
16,3/2/2024 16:00,1402/12/12,0,FQ,3,9,42.5,10.3,9.1,127,1.5,2024,3,6,0
17,3/2/2024 17:00,1402/12/12,0,FQ,3,7.5,50,10.3,9.1,127.8,1.5,2024,3,6,0
18,3/2/2024 18:00,1402/12/12,0,FQ,3,7,53,10.3,9.1,127.8,2.5,2024,3,6,0
7,3/3/2024 7:00,1402/12/13,0,FQ,3,6,51.5,10.3,9.1,131.2,1,2024,3,6,0
20,3/2/2024 20:00,1402/12/12,0,FQ,3,8,49,10.3,9.1,126.3,2.5,2024,3,6,0
9,3/3/2024 9:00,1402/12/13,0,FQ,3,8.5,39,10.3,9.1,127,1,2024,3,6,0
10,3/3/2024 10:00,1402/12/13,0,FQ,3,10.5,33,10.3,9.1,126.2,1.5,2024,3,6,0
11,3/3/2024 11:00,1402/12/13,0,FQ,3,11,33,10.3,9.1,126.2,1.5,2024,3,6,0
12,3/3/2024 12:00,1402/12/13,0,FQ,3,14,27,10.3,9.1,125.3,1.5,2024,3,0,0
13,3/3/2024 13:00,1402/12/13,0,FQ,3,13,32.5,10.3,9.1,124.5,1.5,2024,3,0,0
14,3/3/2024 14:00,1402/12/13,0,FQ,3,13.5,34.5,10.3,9.1,124.5,1.5,2024,3,0,0
3,3/4/2024 3:00,1402/12/14,0,FQ,3,14,37.5,10.3,9.1,128.7,1,2024,3,0,0
16,3/3/2024 16:00,1402/12/13,0,FQ,3,14,37,10.3,9.1,124.5,1.5,2024,3,0,0
5,3/4/2024 5:00,1402/12/14,0,FQ,3,13.5,38.5,10.3,9.1,128.7,1,2024,3,0,0
6,3/4/2024 6:00,1402/12/14,7.5,FQ,3,13,33.5,10.3,9.1,128.7,1,2024,3,0,0
7,3/4/2024 7:00,1402/12/14,60,FQ,3,13,32.5,10.3,9.1,128.7,1,2024,3,0,0
20,3/3/2024 20:00,1402/12/13,62.5,SO,3,10.5,28.5,10.3,9.1,123.8,2.5,2024,3,0,0
21,3/3/2024 21:00,1402/12/13,62.5,SO,3,12,28.5,10.3,9.1,124.7,2.5,2024,3,0,0
22,3/3/2024 22:00,1402/12/13,62.5,SO,3,13,31,10.3,9.1,124.7,1.5,2024,3,0,0
11,3/4/2024 11:00,1402/12/14,0,FQ,3,14,30,10.3,9.1,128.7,1.5,2024,3,0,0
12,3/4/2024 12:00,1402/12/14,0,FQ,3,14,56,10.3,9.1,128.7,1.5,2024,3,1,0
13,3/4/2024 13:00,1402/12/14,0,FQ,3,13.5,54,10.3,9.1,127,1.5,2024,3,1,0
14,3/4/2024 14:00,1402/12/14,0,FQ,3,13,56,10.3,9.1,127,1.5,2024,3,1,0
15,3/4/2024 15:00,1402/12/14,0,FQ,3,12.5,58.5,10.3,9.1,127,1.5,2024,3,1,0
16,3/4/2024 16:00,1402/12/14,0,FQ,3,12,60,10.3,9.1,127.8,1.5,2024,3,1,0
5,3/5/2024 5:00,1402/12/15,0,FQ,3,12,60.5,10.3,9.1,128.7,1,2024,3,1,0
6,3/5/2024 6:00,1402/12/15,0,FQ,3,10.5,63,10.3,9.1,128.7,1,2024,3,1,0
7,3/5/2024 7:00,1402/12/15,0,FQ,3,11,61.5,10.3,9.1,128.7,1,2024,3,1,0
8,3/5/2024 8:00,1402/12/15,0,FQ,3,12.5,55.5,10.3,9.1,126.2,1,2024,3,1,0
9,3/5/2024 9:00,1402/12/15,0,FQ,3,12,57.5,10.3,9.1,125.3,1,2024,3,1,0
10,3/5/2024 10:00,1402/12/15,0,FQ,3,12.5,53.5,10.3,9.1,124.5,1.5,2024,3,1,0
11,3/5/2024 11:00,1402/12/15,0,FQ,3,13,53.5,10.3,9.1,128.7,1.5,2024,3,1,0
12,3/5/2024 12:00,1402/12/15,0,FQ,3,12.5,44.5,10.3,9.1,128.7,1.5,2024,3,2,0
13,3/5/2024 13:00,1402/12/15,0,FQ,3,14,43.5,10.3,9.1,127,1.5,2024,3,2,0
14,3/5/2024 14:00,1402/12/15,0,FQ,3,12,51.5,10.3,9.1,127,1.5,2024,3,2,0
15,3/5/2024 15:00,1402/12/15,0,FQ,3,12,50.5,10.3,9.1,127,1.5,2024,3,2,0
16,3/5/2024 16:00,1402/12/15,0,FQ,3,11,57,10.3,9.1,127.8,1.5,2024,3,2,0
5,3/6/2024 5:00,1402/12/16,0,FQ,3,9.5,65.5,10.3,9.1,128.7,1,2024,3,2,0
18,3/5/2024 18:00,1402/12/15,0,FQ,3,9,65.5,10.3,9.1,125.3,2.5,2024,3,2,0
7,3/6/2024 7:00,1402/12/16,0,FQ,3,8,64.5,10.3,9.1,128.7,1,2024,3,2,0
8,3/6/2024 8:00,1402/12/16,0,FQ,3,10.5,53,10.3,9.1,126.2,1,2024,3,2,0
9,3/6/2024 9:00,1402/12/16,0,FQ,3,10.5,46.5,10.3,9.1,125.3,1,2024,3,2,0
10,3/6/2024 10:00,1402/12/16,0,FQ,3,11.5,43,10.3,9.1,124.5,1.5,2024,3,2,0
11,3/6/2024 11:00,1402/12/16,0,FQ,3,12.5,44,10.3,9.1,128.7,1.5,2024,3,2,0
24,3/6/2024 0:00,1402/12/16,0,FQ,3,13,45.5,10.3,9.1,125.5,1.5,2024,3,3,0
1,3/7/2024 1:00,1402/12/17,0,FQ,3,13,49,10.3,9.1,128.7,1,2024,3,3,0
14,3/6/2024 14:00,1402/12/16,0,FQ,3,12.5,44,10.3,9.1,127,1.5,2024,3,3,0
15,3/6/2024 15:00,1402/12/16,0,FQ,3,12,47.5,10.3,9.1,127,1.5,2024,3,3,0
16,3/6/2024 16:00,1402/12/16,0,FQ,3,11,49,10.3,9.1,127.8,1.5,2024,3,3,0
17,3/6/2024 17:00,1402/12/16,0,FQ,3,10.5,51.5,10.3,9.1,124.5,1.5,2024,3,3,0
6,3/7/2024 6:00,1402/12/17,0,FQ,3,8,56,10.3,9.1,128.7,1,2024,3,3,7.499999888
19,3/6/2024 19:00,1402/12/16,0,FQ,3,6.5,64.5,10.3,9.1,123.8,2.5,2024,3,3,59.99999922
20,3/6/2024 20:00,1402/12/16,0,FQ,3,9,57.5,10.3,9.1,123.8,2.5,2024,3,3,62.49999996
9,3/7/2024 9:00,1402/12/17,0,FQ,3,13,39.5,10.3,9.1,125.3,1,2024,3,3,62.5
22,3/6/2024 22:00,1402/12/16,0,FQ,3,13,42,10.3,9.1,124.7,1.5,2024,3,3,62.5
11,3/7/2024 11:00,1402/12/17,0,FQ,3,13.5,40,10.3,9.1,128.7,1.5,2024,3,3,9.31E-07
12,3/7/2024 12:00,1402/12/17,0,FQ,3,15.5,27.5,10.3,9.1,128.7,1.5,2024,3,4,2.07E-22
1,3/8/2024 1:00,1402/12/18,0,FQ,3,15.5,28.5,10.3,9.1,124.5,1,2024,3,4,4.59E-38
14,3/7/2024 14:00,1402/12/17,0,FQ,3,15.5,31.5,10.3,9.1,127,1.5,2024,3,4,1.02E-53
3,3/8/2024 3:00,1402/12/18,0,FQ,3,15,31,10.3,9.1,124.5,1,2024,3,4,2.26E-69
16,3/7/2024 16:00,1402/12/17,0,FQ,3,15.5,32.5,10.3,9.1,127.8,1.5,2024,3,4,5.03E-85
5,3/8/2024 5:00,1402/12/18,0,FQ,3,15,39.5,10.3,9.1,125.3,1,2024,3,4,1.12E-100
6,3/8/2024 6:00,1402/12/18,0,FQ,3,12.5,46.5,10.3,9.1,125.3,1,2024,3,4,2.48E-116
19,3/7/2024 19:00,1402/12/17,0,FQ,3,11,48.5,10.3,9.1,123.8,2.5,2024,3,4,5.50E-132
20,3/7/2024 20:00,1402/12/17,0,FQ,3,11.5,41,10.3,9.1,123.8,2.5,2024,3,4,1.22E-147
21,3/7/2024 21:00,1402/12/17,0,FQ,3,12.5,31,10.3,9.1,124.7,2.5,2024,3,4,2.71E-163
10,3/8/2024 10:00,1402/12/18,0,FQ,3,14,30.5,10.3,9.1,126.2,1.5,2024,3,4,6.02E-179
11,3/8/2024 11:00,1402/12/18,0,FQ,3,15.5,29,10.3,9.1,125.3,1.5,2024,3,4,1.34E-194
12,3/8/2024 12:00,1402/12/18,0,FQ,3,19.5,31.5,10.3,9.1,125.3,1.5,2024,3,5,2.97E-210
1,3/9/2024 1:00,1402/12/19,0,FQ,3,19,30.5,10.3,9.1,124.5,1,2024,3,5,6.60E-226
2,3/9/2024 2:00,1402/12/19,0,FQ,3,19,35,10.3,9.1,124.5,1,2024,3,5,1.46E-241
3,3/9/2024 3:00,1402/12/19,0,FQ,3,18.5,36,10.3,9.1,124.5,1,2024,3,5,3.25E-257
4,3/9/2024 4:00,1402/12/19,0,FQ,3,17.5,36.5,10.3,9.1,124.5,1,2024,3,5,7.22E-273
17,3/8/2024 17:00,1402/12/18,0,FQ,3,17.5,37,10.3,9.1,127,1.5,2024,3,5,1.60E-288
18,3/8/2024 18:00,1402/12/18,0,FQ,3,14,46,10.3,9.1,127.8,2.5,2024,3,5,3.56E-304
7,3/9/2024 7:00,1402/12/19,0,FQ,3,12.5,46,10.3,9.1,125.3,1,2024,3,5,7.905e-320
20,3/8/2024 20:00,1402/12/18,0,FQ,3,13.5,45.5,10.3,9.1,127.2,2.5,2024,3,5,0
21,3/8/2024 21:00,1402/12/18,0,FQ,3,16.5,35,10.3,9.1,127.2,2.5,2024,3,5,0
10,3/9/2024 10:00,1402/12/19,0,FQ,3,18,33,10.3,9.1,126.2,1.5,2024,3,5,0
23,3/8/2024 23:00,1402/12/18,0,FQ,3,18.5,34,10.3,9.1,123,1.5,2024,3,5,0
24,3/9/2024 0:00,1402/12/19,0,FQ,3,15,39,10.3,9.1,123,1.5,2024,3,6,0
1,3/10/2024 1:00,1402/12/20,0,FQ,3,15,36,10.3,9.1,128.7,1,2024,3,6,0
14,3/9/2024 14:00,1402/12/19,0,FQ,3,14.5,34,10.3,9.1,126.2,1.5,2024,3,6,0
15,3/9/2024 15:00,1402/12/19,0,FQ,3,14,38,10.3,9.1,126.2,1.5,2024,3,6,0
16,3/9/2024 16:00,1402/12/19,0,FQ,3,13,40.5,10.3,9.1,126.2,1.5,2024,3,6,0
5,3/10/2024 5:00,1402/12/20,0,FQ,3,12,44.5,10.3,9.1,125.3,1,2024,3,6,0
6,3/10/2024 6:00,1402/12/20,0,FQ,3,10.5,44,10.3,9.1,125.3,1,2024,3,6,0
19,3/9/2024 19:00,1402/12/19,0,FQ,3,9.5,49.5,10.3,9.1,126.3,2.5,2024,3,6,0
8,3/10/2024 8:00,1402/12/20,0,FQ,3,11,47,10.3,9.1,128.7,1,2024,3,6,0
9,3/10/2024 9:00,1402/12/20,0,FQ,3,12.5,35.5,10.3,9.1,126.2,1,2024,3,6,0
22,3/9/2024 22:00,1402/12/19,0,FQ,3,14,30.5,10.3,9.1,127.2,1.5,2024,3,6,0
23,3/9/2024 23:00,1402/12/19,55,FQ,3,15,30.5,10.3,9.1,123,1.5,2024,3,6,0
24,3/10/2024 0:00,1402/12/20,117,SO,3,15,28,10.3,9.1,126.3,1.5,2024,3,0,0
1,3/11/2024 1:00,1402/12/21,112.5,SO,3,15.5,28.5,9.9,8.8,128.7,1,2024,3,0,0
14,3/10/2024 14:00,1402/12/20,116.5,SO,3,15,33.5,9.9,8.8,124.5,1.5,2024,3,0,0
3,3/11/2024 3:00,1402/12/21,114,SO,3,14.5,33.5,9.55,8.65,124.5,1,2024,3,0,0
4,3/11/2024 4:00,1402/12/21,113.5,SO,3,13.5,34.5,9.55,8.65,124.5,1,2024,3,0,0
17,3/10/2024 17:00,1402/12/20,112.5,SO,3,14,39.5,9.55,8.65,125.3,1.5,2024,3,0,0
6,3/11/2024 6:00,1402/12/21,111,SO,3,12.5,42,9.55,8.65,125.3,1,2024,3,0,0
19,3/10/2024 19:00,1402/12/20,111,SO,3,11.5,47.5,9.85,8.85,124.7,2.5,2024,3,0,0
8,3/11/2024 8:00,1402/12/21,110,SO,3,11.5,49.5,9.85,8.85,128.7,1,2024,3,0,0
21,3/10/2024 21:00,1402/12/20,119,SO,3,13.5,39.5,9.85,8.85,125.5,2.5,2024,3,0,0
22,3/10/2024 22:00,1402/12/20,119,SO,3,15,31,9.85,8.85,125.5,1.5,2024,3,0,0
11,3/11/2024 11:00,1402/12/21,118,SO,3,15.5,32,9.8,8.85,125.3,1.5,2024,3,0,0
24,3/11/2024 0:00,1402/12/21,98,LF1,3,15.5,51,9.8,8.85,126.3,1.5,2024,3,1,0
13,3/11/2024 13:00,1402/12/21,98.5,LF1,3,15,52,7.95,7.75,124.5,1.5,2024,3,1,0
2,3/12/2024 2:00,1402/12/22,106,SO,3,14.5,55,7.95,7.75,128.7,1,2024,3,1,0
15,3/11/2024 15:00,1402/12/21,130.5,LF1,3,13.5,56,10.15,9,124.5,1.5,2024,3,1,0
16,3/11/2024 16:00,1402/12/21,126,LF1,3,13.5,56.5,10.15,9,125.3,1.5,2024,3,1,0
17,3/11/2024 17:00,1402/12/21,126,LF1,3,12,66.5,10.15,9,125.3,1.5,2024,3,1,0
6,3/12/2024 6:00,1402/12/22,126,SO,3,11,63.5,10.15,9,125.3,1,2024,3,1,0
19,3/11/2024 19:00,1402/12/21,128,LF1,3,11.5,63,10.05,9.15,124.7,2.5,2024,3,1,0
20,3/11/2024 20:00,1402/12/21,125,LF1,3,13,63,10.05,9.15,125.5,2.5,2024,3,1,0
21,3/11/2024 21:00,1402/12/21,124.5,LF1,3,13.5,52.5,10.05,9.15,125.5,2.5,2024,3,1,0
22,3/11/2024 22:00,1402/12/21,123,LF1,3,14,49.5,10.05,9.15,125.5,1.5,2024,3,1,0
11,3/12/2024 11:00,1402/12/22,122.5,SO,3,14,49.5,8.05,7.65,125.3,1.5,2024,3,1,0
24,3/12/2024 0:00,1402/12/22,110,SO,3,14,45.5,8.05,7.65,126.3,1.5,2024,3,2,0
1,3/13/2024 1:00,1402/12/23,110,SO,3,14.5,48.5,10,8.85,126.2,1,2024,3,2,0
14,3/12/2024 14:00,1402/12/22,110,SO,3,14,49.5,10,8.85,124.5,1.5,2024,3,2,0
15,3/12/2024 15:00,1402/12/22,110,SO,3,13.5,52.5,9.7,8.85,124.5,1.5,2024,3,2,0
16,3/12/2024 16:00,1402/12/22,110,SO,3,13.5,56.5,9.7,8.85,125.3,1.5,2024,3,2,0
17,3/12/2024 17:00,1402/12/22,110,SO,3,13,60,9.7,8.85,125.3,1.5,2024,3,2,0
18,3/12/2024 18:00,1402/12/22,85,SO,3,11.5,64.5,9.7,8.85,126.2,2.5,2024,3,2,0
7,3/13/2024 7:00,1402/12/23,55,FA,3,10.5,68,10,8.9,0,1,2024,3,2,0
20,3/12/2024 20:00,1402/12/22,55,SO,3,12,59.5,10,8.9,125.5,2.5,2024,3,2,0
9,3/13/2024 9:00,1402/12/23,55,FA,3,13,50,10,8.9,0,1,2024,3,2,0
10,3/13/2024 10:00,1402/12/23,55,FA,3,15.5,43.5,10,8.9,0,1.5,2024,3,2,0
23,3/12/2024 23:00,1402/12/22,55,SO,3,16,47,10.15,8.95,126.3,1.5,2024,3,2,54.99999918
12,3/13/2024 12:00,1402/12/23,67,FA,3,16,39,10.15,8.95,0,1.5,2024,3,3,0
13,3/13/2024 13:00,1402/12/23,68,FA,3,16,39,10.45,9.2,0,1.5,2024,3,3,0
14,3/13/2024 14:00,1402/12/23,68,FA,3,16.5,34,10.45,9.2,0,1.5,2024,3,3,0
15,3/13/2024 15:00,1402/12/23,68,FA,3,16.5,37,10.4,9.25,0,1.5,2024,3,3,0
4,3/14/2024 4:00,1402/12/24,68.5,LA,3,16,41,10.4,9.25,124.5,1,2024,3,3,113.5
5,3/14/2024 5:00,1402/12/24,99,LA,3,14.5,48,10.4,9.25,125.3,1,2024,3,3,112.5
6,3/14/2024 6:00,1402/12/24,132.5,LA,3,13,53.5,10.4,9.25,125.3,1,2024,3,3,111
7,3/14/2024 7:00,1402/12/24,133.5,LA,3,12,53,10.35,9.2,125.3,1,2024,3,3,111
8,3/14/2024 8:00,1402/12/24,135.5,LA,3,13,49,10.35,9.2,128.7,1,2024,3,3,110
21,3/13/2024 21:00,1402/12/23,135,LA,3,14,45,10.35,9.2,127.2,2.5,2024,3,3,118.9999999
22,3/13/2024 22:00,1402/12/23,134.5,LA,3,16.5,40.5,10.35,9.2,123,1.5,2024,3,3,119
23,3/13/2024 23:00,1402/12/23,133.5,LA,3,16.5,36,10.35,9.25,123.8,1.5,2024,3,3,118
12,3/14/2024 12:00,1402/12/24,133.5,SO,3,18,37,10.35,9.25,125.3,1.5,2024,3,4,98.0000003
13,3/14/2024 13:00,1402/12/24,133,SO,3,18.5,33,10.55,9.35,124.5,1.5,2024,3,4,98.49999999
2,3/15/2024 2:00,1402/12/25,131,LF1,3,18.5,33.5,10.55,9.35,128.7,1,2024,3,4,105.9999999
15,3/14/2024 15:00,1402/12/24,128.5,SO,3,20,30,10.65,9.2,124.5,1.5,2024,3,4,130.4999996
16,3/14/2024 16:00,1402/12/24,121,SO,3,19,30.5,10.65,9.2,125.3,1.5,2024,3,4,126.0000001
17,3/14/2024 17:00,1402/12/24,122,SO,3,20,29,10.65,9.2,125.3,1.5,2024,3,4,126
18,3/14/2024 18:00,1402/12/24,121.5,SO,3,17,33.5,10.65,9.2,126.2,2.5,2024,3,4,126
19,3/14/2024 19:00,1402/12/24,122.5,SO,3,16,31.5,10.65,9.25,124.7,2.5,2024,3,4,128
8,3/15/2024 8:00,1402/12/25,84.5,LF1,3,15.5,35,10.65,9.25,128.7,1,2024,3,4,125
21,3/14/2024 21:00,1402/12/24,64.5,LF1,3,15.5,38,10.65,9.25,125.5,2.5,2024,3,4,124.5
22,3/14/2024 22:00,1402/12/24,65.5,LF1,3,16,39,10.65,9.25,125.5,1.5,2024,3,4,123
23,3/14/2024 23:00,1402/12/24,66.5,LF1,3,17,43,10.15,9.05,126.3,1.5,2024,3,4,122.5
24,3/15/2024 0:00,1402/12/25,62.5,SO,3,17,40,10.15,9.05,126.3,1.5,2024,3,5,110.0000002
13,3/15/2024 13:00,1402/12/25,62,FA,3,19,36.5,10.2,9.05,124.5,1.5,2024,3,5,110
2,3/16/2024 2:00,1402/12/26,0,FQ,3,19.5,38.5,10.2,9.05,127.8,1,2024,3,5,110
15,3/15/2024 15:00,1402/12/25,0,FA,3,19.5,42.5,10.2,9.05,124.5,1.5,2024,3,5,110
16,3/15/2024 16:00,1402/12/25,0,FA,3,19.5,46,10.2,9.05,125.3,1.5,2024,3,5,110
17,3/15/2024 17:00,1402/12/25,10,SO,3,19,47,10.2,9.05,125.3,1.5,2024,3,5,110
6,3/16/2024 6:00,1402/12/26,57.5,FQ,3,17.5,49.5,10.2,9.05,127.8,1,2024,3,5,85.00000037
19,3/15/2024 19:00,1402/12/25,58,SO,3,16.5,52.5,10.8,9.2,124.7,2.5,2024,3,5,55.00000045
20,3/15/2024 20:00,1402/12/25,63.5,SO,3,16.5,44.5,10.8,9.2,125.5,2.5,2024,3,5,55
9,3/16/2024 9:00,1402/12/26,76.5,FQ,3,17,41,10.8,9.2,125.3,1,2024,3,5,55
10,3/16/2024 10:00,1402/12/26,125.5,SO,3,17.5,43,10.8,9.2,125.3,1.5,2024,3,5,55
23,3/15/2024 23:00,1402/12/25,121,SO,3,18,42,10.8,9.3,126.3,1.5,2024,3,5,55
12,3/16/2024 12:00,1402/12/26,60,SO,3,18,47,10.8,9.3,125.3,1.5,2024,3,6,66.99999982
13,3/16/2024 13:00,1402/12/26,60,SO,3,19,43.5,10.65,9.25,123.6,1.5,2024,3,6,67.99999999
14,3/16/2024 14:00,1402/12/26,60,SO,3,18.5,50.5,10.65,9.25,122.8,1.5,2024,3,6,68
3,3/17/2024 3:00,1402/12/27,60,FQ,3,18.5,54,10.5,9.25,127.8,1,2024,3,6,68
4,3/17/2024 4:00,1402/12/27,60,FQ,3,18,56,10.5,9.25,127.8,1,2024,3,6,68.49999999
5,3/17/2024 5:00,1402/12/27,60,FQ,3,16.5,58,10.5,9.25,127.8,1,2024,3,6,98.99999955
18,3/16/2024 18:00,1402/12/26,60,SO,3,16,60.5,10.5,9.25,124.5,2.5,2024,3,6,132.4999995
7,3/17/2024 7:00,1402/12/27,60,FQ,3,14,60.5,10.5,9.3,127.8,1,2024,3,6,133.5
20,3/16/2024 20:00,1402/12/26,60,SO,3,15.5,53,10.5,9.3,125.3,2.5,2024,3,6,135.5
21,3/16/2024 21:00,1402/12/26,60,SO,3,16.5,43.5,10.55,9.25,124.7,2.5,2024,3,6,135
22,3/16/2024 22:00,1402/12/26,60,SO,3,18,40,10.55,9.25,124.7,1.5,2024,3,6,134.5
23,3/16/2024 23:00,1402/12/26,60,SO,3,18.5,46.5,10.55,9.25,125.5,1.5,2024,3,6,133.5
24,3/17/2024 0:00,1402/12/27,0,FQ,3,20.5,43,10.55,9.25,125.5,1.5,2024,3,0,133.5
1,3/18/2024 1:00,1402/12/28,0,FQ,3,19.5,42,10.6,9.2,126.2,1,2024,3,0,133
14,3/17/2024 14:00,1402/12/27,0,FQ,3,19.5,42.5,10.6,9.2,122.8,1.5,2024,3,0,131
15,3/17/2024 15:00,1402/12/27,0,FQ,3,19.5,44,10.6,9.2,122.8,1.5,2024,3,0,128.5
16,3/17/2024 16:00,1402/12/27,0,FQ,3,18.5,46.5,10.6,9.2,122.8,1.5,2024,3,0,121.0000001
17,3/17/2024 17:00,1402/12/27,0,FQ,3,17.5,54.5,10.25,8.95,123.6,1.5,2024,3,0,122
6,3/18/2024 6:00,1402/12/28,45,FQ,3,15.5,60.5,10.25,8.95,127,1,2024,3,0,121.5
19,3/17/2024 19:00,1402/12/27,65,FQ,3,16,54.5,10.25,8.95,125.3,2.5,2024,3,0,122.5
20,3/17/2024 20:00,1402/12/27,65.5,FQ,3,17,46,10.25,8.95,125.3,2.5,2024,3,0,84.50000057
9,3/18/2024 9:00,1402/12/28,76,SO,3,18,47,10.25,8.95,121.1,1,2024,3,0,64.5000003
22,3/17/2024 22:00,1402/12/27,63.5,FQ,3,18.5,44,10.25,8.95,124.7,1.5,2024,3,0,65.49999999
23,3/17/2024 23:00,1402/12/27,63,FQ,3,19.5,41,10.25,8.95,125.5,1.5,2024,3,0,66.49999999
12,3/18/2024 12:00,1402/12/28,119,SO,3,22,38.5,10.25,8.95,118.6,1.5,2024,3,1,62.50000006
13,3/18/2024 13:00,1402/12/28,119.5,SO,3,22.5,37.5,10,8.75,117.8,1.5,2024,3,1,62.00000001
14,3/18/2024 14:00,1402/12/28,104,SO,3,22,40,10,8.75,117.8,1.5,2024,3,1,9.24E-07
3,3/19/2024 3:00,1402/12/29,101.5,SO,3,22.5,41.5,8.6,7.95,126.2,1,2024,3,1,2.05E-22
4,3/19/2024 4:00,1402/12/29,101,SO,3,22.5,41.5,8.6,7.95,127,1,2024,3,1,4.56E-38
5,3/19/2024 5:00,1402/12/29,100,SO,3,22,42.5,8.6,7.95,127,1,2024,3,1,9.999999851
6,3/19/2024 6:00,1402/12/29,102.5,SO,3,19,60,8.6,7.95,127,1,2024,3,1,57.49999929
19,3/18/2024 19:00,1402/12/28,101.5,SO,3,18,59,8.6,7.9,123.6,2.5,2024,3,1,57.99999999
20,3/18/2024 20:00,1402/12/28,103,SO,3,17.5,62,8.6,7.9,123.6,2.5,2024,3,1,63.49999992
21,3/18/2024 21:00,1402/12/28,103,SO,3,18,61.5,8.6,7.9,123,2.5,2024,3,1,76.49999981
22,3/18/2024 22:00,1402/12/28,103.5,SO,3,17.5,62,8.6,7.9,123,1.5,2024,3,1,125.4999993
11,3/19/2024 11:00,1402/12/29,103.5,SO,3,17.5,61.5,8.7,8.65,118.6,1.5,2024,3,1,121.0000001
24,3/19/2024 0:00,1402/12/29,124.5,LF1,3,17.5,87.5,8.7,8.65,123.8,1.5,2024,3,2,60.00000091
13,3/19/2024 13:00,1402/12/29,124.5,SO,3,17.5,86.5,9.1,8.9,117.8,1.5,2024,3,2,60
14,3/19/2024 14:00,1402/12/29,50,SO,3,17.5,94,9.1,8.9,117.8,1.5,2024,3,2,60
15,3/19/2024 15:00,1402/12/29,50,SO,3,17,97,9.8,8.6,119.5,1.5,2024,3,2,60
16,3/19/2024 16:00,1402/12/29,50,SO,3,15,100,9.8,8.6,120.3,1.5,2024,3,2,60
5,3/20/2024 5:00,1403/01/01,50,RLF1,3,14.5,99.5,9.8,8.6,126.2,1,2024,3,2,60
6,3/20/2024 6:00,1403/01/01,50,RLF1,3,14.5,98.5,9.8,8.6,126.2,1,2024,3,2,60
7,3/20/2024 7:00,1403/01/01,67,RLF1,3,14.5,98,10.75,9.3,125.3,1,2024,3,2,60
8,3/20/2024 8:00,1403/01/01,67,RLF1,3,15.5,83.5,10.75,9.3,128.7,1,2024,3,2,60
9,3/20/2024 9:00,1403/01/01,67,RLF1,3,16,73.5,10.75,9.3,127,1,2024,3,2,60
10,3/20/2024 10:00,1403/01/01,67,RLF1,3,16.5,73,10.75,9.3,126.2,1.5,2024,3,2,60
23,3/19/2024 23:00,1402/12/29,66.5,LF1,3,18,70,10.9,9.3,123.8,1.5,2024,3,2,60
24,3/20/2024 0:00,1403/01/01,0,RLF1,3,15,69,10.9,9.3,123,1.5,2024,3,3,8.94E-07
1,3/21/2024 1:00,1403/01/02,0,RLF1,3,15,62.5,10.9,9.3,125.3,1,2024,3,3,1.99E-22
14,3/20/2024 14:00,1403/01/01,0,RLF1,3,15,62.5,10.9,9.3,123.6,1.5,2024,3,3,4.41E-38
15,3/20/2024 15:00,1403/01/01,0,RLF1,3,14.5,65,10.9,9.3,124.5,1.5,2024,3,3,9.79E-54
16,3/20/2024 16:00,1403/01/01,0,RLF1,3,14.5,62,10.9,9.3,125.3,1.5,2024,3,3,2.17E-69
17,3/20/2024 17:00,1403/01/01,0,RLF1,3,13.5,59.5,10.9,9.3,126.2,1.5,2024,3,3,4.83E-85
18,3/20/2024 18:00,1403/01/01,0,RLF1,3,12.5,58,10.9,9.3,126.2,1.5,2024,3,3,44.99999933
7,3/21/2024 7:00,1403/01/02,0,RLF1,3,10.5,75,10.9,9.3,125.3,1,2024,3,3,64.9999997
20,3/20/2024 20:00,1403/01/01,0,RLF1,3,12,65.5,10.9,9.3,127,1.5,2024,3,3,65.49999999
21,3/20/2024 21:00,1403/01/01,0,RLF1,3,13,59.5,10.9,9.3,126.3,2.5,2024,3,3,75.99999984
22,3/20/2024 22:00,1403/01/01,0,RLF1,3,14.5,56.5,10.9,9.3,126.3,2.5,2024,3,3,63.50000019
23,3/20/2024 23:00,1403/01/01,0,RLF1,3,15,57,10.9,9.3,127.2,1.5,2024,3,3,63.00000001
12,3/21/2024 12:00,1403/01/02,0,RLF1,3,15,39,10.9,9.3,124.5,1.5,2024,3,4,118.9999992
13,3/21/2024 13:00,1403/01/02,0,RLF1,3,15,42,10.45,9,123.6,1.5,2024,3,4,119.5
14,3/21/2024 14:00,1403/01/02,0,RLF1,3,15,47.5,10.45,9,123.6,1.5,2024,3,4,104.0000002
15,3/21/2024 15:00,1403/01/02,0,RLF1,3,15.5,49,10.45,9,124.5,1.5,2024,3,4,101.5
16,3/21/2024 16:00,1403/01/02,0,RLF1,3,15,48.5,10.45,9,125.3,1.5,2024,3,4,101
5,3/22/2024 5:00,1403/01/03,0,RLF1,3,14.5,51.5,10.45,9,127.8,1,2024,3,4,100
18,3/21/2024 18:00,1403/01/02,0,RLF1,3,13,53.5,10.45,9,126.2,1.5,2024,3,4,102.5
19,3/21/2024 19:00,1403/01/02,0,RLF1,3,12.5,53,10,8.7,127,1.5,2024,3,4,101.5
20,3/21/2024 20:00,1403/01/02,0,RLF1,3,12.5,50.5,10,8.7,127,1.5,2024,3,4,103
9,3/22/2024 9:00,1403/01/03,0,RLF1,3,12.5,50,10,8.7,127,1,2024,3,4,103
10,3/22/2024 10:00,1403/01/03,0,RLF1,3,12.5,52.5,10,8.7,127,1.5,2024,3,4,103.5
11,3/22/2024 11:00,1403/01/03,0,RLF1,3,12.5,53,10,8.7,127,1.5,2024,3,4,103.5
12,3/22/2024 12:00,1403/01/03,0,RLF1,3,13.5,63,10,8.7,126.2,1.5,2024,3,5,124.4999997
1,3/23/2024 1:00,1403/01/04,0,RLF1,3,15,58,10,8.7,127.8,1,2024,3,5,124.5
14,3/22/2024 14:00,1403/01/03,0,RLF1,3,15,55.5,10,8.7,124.5,1.5,2024,3,5,50.00000111
3,3/23/2024 3:00,1403/01/04,0,RLF1,3,14,76.5,10,8.7,127.8,1,2024,3,5,50
4,3/23/2024 4:00,1403/01/04,0,RLF1,3,13.5,79,10,8.7,127.8,1,2024,3,5,50
17,3/22/2024 17:00,1403/01/03,0,RLF1,3,13,83,10,8.7,126.2,1.5,2024,3,5,50
6,3/23/2024 6:00,1403/01/04,0,RLF1,3,12.5,86,10,8.7,127.8,1,2024,3,5,50
7,3/23/2024 7:00,1403/01/04,0,RLF1,3,12.5,87,10,8.7,127.8,1,2024,3,5,66.99999975
8,3/23/2024 8:00,1403/01/04,0,RLF1,3,13.5,77,10,8.7,127,1,2024,3,5,67
21,3/22/2024 21:00,1403/01/03,0,RLF1,3,15.5,73,10,8.7,125.5,2.5,2024,3,5,67
22,3/22/2024 22:00,1403/01/03,0,RLF1,3,16.5,67.5,10,8.7,125.5,2.5,2024,3,5,67
23,3/22/2024 23:00,1403/01/03,58.5,RLF1,3,17,67.5,10,8.7,125.5,1.5,2024,3,5,66.50000001
12,3/23/2024 12:00,1403/01/04,119.5,SO,3,17.5,40,10,8.7,126.2,1.5,2024,3,6,9.91E-07
1,3/24/2024 1:00,1403/01/05,117.5,SO,3,18,46.5,10,8.8,124.5,1,2024,3,6,2.20E-22
14,3/23/2024 14:00,1403/01/04,117.5,SO,3,18.5,44.5,10,8.8,124.5,1.5,2024,3,6,4.89E-38
15,3/23/2024 15:00,1403/01/04,118,SO,3,18,45,10.15,8.9,124.5,1.5,2024,3,6,1.08E-53
16,3/23/2024 16:00,1403/01/04,118,SO,3,18.5,48,10.15,8.9,125.3,1.5,2024,3,6,2.41E-69
17,3/23/2024 17:00,1403/01/04,117,SO,3,18,52,10.15,8.9,126.2,1.5,2024,3,6,5.35E-85
18,3/23/2024 18:00,1403/01/04,92.5,SO,3,16.5,61,10.15,8.9,126.2,1.5,2024,3,6,1.19E-100
7,3/24/2024 7:00,1403/01/05,94,SO,3,15,68.5,8,7.6,125.3,1,2024,3,6,2.64E-116
20,3/23/2024 20:00,1403/01/04,95,SO,3,14,65.5,8,7.6,126.2,1.5,2024,3,6,5.86E-132
21,3/23/2024 21:00,1403/01/04,95,SO,3,14,70.5,8,7.6,125.5,2.5,2024,3,6,1.30E-147
10,3/24/2024 10:00,1403/01/05,123,SO,3,14,70,8,7.6,128.7,1.5,2024,3,6,2.89E-163
23,3/23/2024 23:00,1403/01/04,123.5,SO,3,14.5,65,10,8.95,125.5,1.5,2024,3,6,6.41E-179
12,3/24/2024 12:00,1403/01/05,123.5,SO,3,15,93,10,8.95,128.7,1.5,2024,3,0,1.42E-194
13,3/24/2024 13:00,1403/01/05,123.5,SO,3,15.5,88.5,10.5,9.15,128.7,1.5,2024,3,0,3.16E-210
14,3/24/2024 14:00,1403/01/05,124,SO,3,16,86.5,10.5,9.15,128.7,1.5,2024,3,0,7.02E-226
15,3/24/2024 15:00,1403/01/05,124,SO,3,16,86.5,10.8,9.15,128.7,1.5,2024,3,0,1.56E-241
16,3/24/2024 16:00,1403/01/05,124,SO,3,16.5,86,10.8,9.15,128.7,1.5,2024,3,0,3.46E-257
17,3/24/2024 17:00,1403/01/05,124,SO,3,16,88.5,10.8,9.15,124.5,1.5,2024,3,0,7.68E-273
6,3/25/2024 6:00,1403/01/06,96.5,SO,3,16,95.5,10.8,9.15,125.3,1,2024,3,0,1.71E-288
7,3/25/2024 7:00,1403/01/06,96.5,SO,3,16,97,9.35,8.35,125.3,1,2024,3,0,3.79E-304
8,3/25/2024 8:00,1403/01/06,112.5,SO,3,16.5,97.5,9.35,8.35,128.7,1,2024,3,0,8.411e-320
9,3/25/2024 9:00,1403/01/06,112.5,SO,3,16.5,96.5,9.35,8.35,128.7,1,2024,3,0,0
22,3/24/2024 22:00,1403/01/05,122.5,SO,3,16.5,98,9.35,8.35,123.8,2.5,2024,3,0,0
23,3/24/2024 23:00,1403/01/05,122.5,SO,3,16,99.5,10.6,9.05,123.8,1.5,2024,3,0,0
12,3/25/2024 12:00,1403/01/06,121,SO,3,14,91,10.6,9.05,128.7,1.5,2024,3,1,0
13,3/25/2024 13:00,1403/01/06,121.5,SO,3,14,93.5,10.1,8.8,128.7,1.5,2024,3,1,0
14,3/25/2024 14:00,1403/01/06,60,SO,3,14,87,10.1,8.8,128.7,1.5,2024,3,1,0
3,3/26/2024 3:00,1403/01/07,60,R,3,13.5,90,10.05,8.8,127.8,1,2024,3,1,0
16,3/25/2024 16:00,1403/01/06,60,SO,3,14,90,10.05,8.8,128.7,1.5,2024,3,1,0
17,3/25/2024 17:00,1403/01/06,60,SO,3,13.5,88.5,10.05,8.8,124.5,1.5,2024,3,1,0
18,3/25/2024 18:00,1403/01/06,60,SO,3,12.5,80.5,10.05,8.8,124.5,1.5,2024,3,1,0
19,3/25/2024 19:00,1403/01/06,60,SO,3,13,84.5,9.9,8.9,124.5,1.5,2024,3,1,0
20,3/25/2024 20:00,1403/01/06,60,SO,3,13,78.5,9.9,8.9,124.5,1.5,2024,3,1,0
9,3/26/2024 9:00,1403/01/07,120,SO,3,13.5,75.5,9.9,8.9,124.5,1,2024,3,1,0
22,3/25/2024 22:00,1403/01/06,121,SO,3,14,66,9.9,8.9,123.8,2.5,2024,3,1,0
23,3/25/2024 23:00,1403/01/06,121.5,SO,3,14.5,61,9.9,8.8,123.8,1.5,2024,3,1,58.49999913
24,3/26/2024 0:00,1403/01/07,121,SO,3,14.5,57,9.9,8.8,123.8,1.5,2024,3,2,119.4999991
13,3/26/2024 13:00,1403/01/07,118.5,SO,3,14.5,55,9.85,8.8,126.2,1.5,2024,3,2,117.5
14,3/26/2024 14:00,1403/01/07,116,SO,3,14,60,9.85,8.8,126.2,1.5,2024,3,2,117.5
3,3/27/2024 3:00,1403/01/08,119.5,SO,3,13,61.5,9.45,8.65,127,1,2024,3,2,118
16,3/26/2024 16:00,1403/01/07,116.5,SO,3,12.5,62,9.45,8.65,127,1.5,2024,3,2,118
17,3/26/2024 17:00,1403/01/07,117.5,SO,3,12,70.5,9.45,8.65,127.8,1.5,2024,3,2,117
6,3/27/2024 6:00,1403/01/08,117.5,SO,3,10.5,79.5,9.45,8.65,127,1,2024,3,2,92.50000037
19,3/26/2024 19:00,1403/01/07,100,SO,3,10.5,82,8.9,8.25,128.7,1.5,2024,3,2,93.99999998
20,3/26/2024 20:00,1403/01/07,101,SO,3,12.5,69.5,8.9,8.25,128.7,1.5,2024,3,2,94.99999999
21,3/26/2024 21:00,1403/01/07,121,SO,3,13,62,8.9,8.25,123,2.5,2024,3,2,95
22,3/26/2024 22:00,1403/01/07,118.5,SO,3,13.5,60,8.9,8.25,123,2.5,2024,3,2,122.9999996
23,3/26/2024 23:00,1403/01/07,118.5,SO,3,15,56,9.9,8.75,123.8,1.5,2024,3,2,123.5
12,3/27/2024 12:00,1403/01/08,118.5,SO,3,15.5,48.5,9.9,8.75,127,1.5,2024,3,3,123.5
13,3/27/2024 13:00,1403/01/08,117.5,SO,3,16,47.5,9.75,8.65,127,1.5,2024,3,3,123.5
2,3/28/2024 2:00,1403/01/09,116.5,SO,3,15.5,49,9.75,8.65,126.2,1,2024,3,3,124
15,3/27/2024 15:00,1403/01/08,116.5,SO,3,15,52,9.55,8.6,127.8,1.5,2024,3,3,124
16,3/27/2024 16:00,1403/01/08,117,SO,3,15,55.5,9.55,8.6,127.8,1.5,2024,3,3,124
17,3/27/2024 17:00,1403/01/08,117.5,SO,3,13.5,61.5,9.55,8.6,128.7,1.5,2024,3,3,124
18,3/27/2024 18:00,1403/01/08,117.5,SO,3,12,68.5,9.55,8.6,124.5,1.5,2024,3,3,96.50000041
19,3/27/2024 19:00,1403/01/08,117.5,SO,3,11,72,9,8.25,124.5,1.5,2024,3,3,96.5
20,3/27/2024 20:00,1403/01/08,108.5,SO,3,13.5,58,9,8.25,124.5,1.5,2024,3,3,112.4999998
21,3/27/2024 21:00,1403/01/08,113.5,SO,3,14.5,56,9,8.25,123.8,2.5,2024,3,3,112.5
10,3/28/2024 10:00,1403/01/09,112.5,SO,3,15.5,50,9,8.25,126.2,1.5,2024,3,3,122.4999999
23,3/27/2024 23:00,1403/01/08,127.5,SO,3,15.5,49,10.05,9.05,123.8,1.5,2024,3,3,122.5
12,3/28/2024 12:00,1403/01/09,134,SO,3,16,43,10.05,9.05,125.3,1.5,2024,3,4,121
13,3/28/2024 13:00,1403/01/09,133.5,LF1,3,15.5,44,10.75,9.45,125.3,1.5,2024,3,4,121.5
14,3/28/2024 14:00,1403/01/09,65.5,LF1,3,16,46,10.75,9.45,125.3,1.5,2024,3,4,60.00000092
3,3/29/2024 3:00,1403/01/10,65.5,FQ,3,15.5,49,10.9,9.3,126.2,1,2024,3,4,60
4,3/29/2024 4:00,1403/01/10,65.5,FQ,3,15,53.5,10.9,9.3,126.2,1,2024,3,4,60
5,3/29/2024 5:00,1403/01/10,65.5,FQ,3,14,55.5,10.9,9.3,126.2,1,2024,3,4,60
6,3/29/2024 6:00,1403/01/10,66.5,FQ,3,12,59.5,10.9,9.3,125.3,1,2024,3,4,60
19,3/28/2024 19:00,1403/01/09,66.5,SO,3,11.5,65,10.8,9.4,127.8,1.5,2024,3,4,60
8,3/29/2024 8:00,1403/01/10,67.5,FQ,3,14,55.5,10.8,9.4,127.8,1,2024,3,4,60
21,3/28/2024 21:00,1403/01/09,67.5,SO,3,15.5,49.5,10.8,9.4,126.3,2.5,2024,3,4,119.9999991
22,3/28/2024 22:00,1403/01/09,68.5,SO,3,15,49,10.8,9.4,127.2,2.5,2024,3,4,121
23,3/28/2024 23:00,1403/01/09,68,SO,3,16.5,44.5,11,9.4,127.2,1.5,2024,3,4,121.5
24,3/29/2024 0:00,1403/01/10,0,FQ,3,17.5,51,11,9.4,123,1.5,2024,3,5,121
13,3/29/2024 13:00,1403/01/10,0,FQ,3,18,45,8.65,7.95,125.3,1.5,2024,3,5,118.5
2,3/30/2024 2:00,1403/01/11,0,FQ,3,17,50.5,8.65,7.95,128.7,1,2024,3,5,116
15,3/29/2024 15:00,1403/01/10,0,FQ,3,17,53.5,8.65,7.95,126.2,1.5,2024,3,5,119.4999999
16,3/29/2024 16:00,1403/01/10,0,FQ,3,16.5,53.5,8.65,7.95,126.2,1.5,2024,3,5,116.5
17,3/29/2024 17:00,1403/01/10,0,FQ,3,16,58.5,8.65,7.95,127,1.5,2024,3,5,117.5
18,3/29/2024 18:00,1403/01/10,0,FQ,3,13.5,69.5,8.65,7.95,127,1.5,2024,3,5,117.5
19,3/29/2024 19:00,1403/01/10,0,FQ,3,14.5,68.5,6.3,6.5,127.8,1.5,2024,3,5,100.0000003
20,3/29/2024 20:00,1403/01/10,0,FQ,3,16.5,61.5,6.3,6.5,127.8,1.5,2024,3,5,101
9,3/30/2024 9:00,1403/01/11,27.5,SO,3,17,56,6.3,6.5,124.5,1,2024,3,5,120.9999997
10,3/30/2024 10:00,1403/01/11,0,SO,3,17.5,55,6.3,6.5,123.6,1.5,2024,3,5,118.5
23,3/29/2024 23:00,1403/01/10,35,FQ,3,18.5,48.5,6.3,6.5,127.2,1.5,2024,3,5,118.5
24,3/30/2024 0:00,1403/01/11,96,SO,3,21,40,6.3,6.5,125.5,1.5,2024,3,6,118.5
13,3/30/2024 13:00,1403/01/11,119.5,SO,3,20.5,41,8.4,7.8,122,1.5,2024,3,6,117.5
2,3/31/2024 2:00,1403/01/12,120,SO,3,20,40,8.4,7.8,128.7,1,2024,3,6,116.5
3,3/31/2024 3:00,1403/01/12,120.5,SO,3,19.5,43.5,10.345,9.05,128.7,1,2024,3,6,116.5
4,3/31/2024 4:00,1403/01/12,122,SO,3,18.5,49.5,10.345,9.05,124.5,1,2024,3,6,117
5,3/31/2024 5:00,1403/01/12,118.5,SO,3,17.5,54,10.345,9.05,124.5,1,2024,3,6,117.5
18,3/30/2024 18:00,1403/01/11,105,SO,3,16.5,58,10.345,9.05,124.5,1.5,2024,3,6,117.5
19,3/30/2024 19:00,1403/01/11,110,SO,3,16.5,61.5,10.65,9.1,125.3,1.5,2024,3,6,117.5
8,3/31/2024 8:00,1403/01/12,122,SO,3,17,59.5,10.65,9.1,126.2,1,2024,3,6,108.5000001
21,3/30/2024 21:00,1403/01/11,123,SO,3,19,53,10.65,9.1,124.7,2.5,2024,3,6,113.4999999
22,3/30/2024 22:00,1403/01/11,121,SO,3,19,49,10.65,9.1,124.7,2.5,2024,3,6,112.5
23,3/30/2024 23:00,1403/01/11,118,SO,3,20,46.5,10.25,8.9,125.5,1.5,2024,3,6,127.4999998
24,3/31/2024 0:00,1403/01/12,117.5,SO,3,19,44.5,10.25,8.9,125.5,1.5,2024,4,0,133.9999999
13,3/31/2024 13:00,1403/01/12,118.5,SO,3,19,40,10.05,8.75,122,1.5,2024,4,0,133.5
2,4/1/2024 2:00,1403/01/13,119,SO,3,19.5,41.5,10.05,8.75,128.7,1,2024,4,0,65.50000101
3,4/1/2024 3:00,1403/01/13,119,SO,3,18.5,44.5,10.05,8.85,128.7,1,2024,4,0,65.5
4,4/1/2024 4:00,1403/01/13,119.5,SO,3,18,50.5,10.05,8.85,124.5,1,2024,4,0,65.5
5,4/1/2024 5:00,1403/01/13,119,SO,3,17,51.5,10.05,8.85,124.5,1,2024,4,0,65.5
6,4/1/2024 6:00,1403/01/13,114.5,SO,3,15,59.5,10.05,8.85,124.5,1,2024,4,0,66.49999999
19,3/31/2024 19:00,1403/01/12,115,SO,3,14,61,9.65,8.6,125.3,1.5,2024,4,0,66.5
20,3/31/2024 20:00,1403/01/12,113,SO,3,16,52,9.65,8.6,125.3,1.5,2024,4,0,67.49999999
21,3/31/2024 21:00,1403/01/12,113.5,SO,3,17,46.5,9.65,8.6,124.7,2.5,2024,4,0,67.5
22,3/31/2024 22:00,1403/01/12,114,SO,3,18,44.5,9.65,8.6,124.7,2.5,2024,4,0,68.49999999
11,4/1/2024 11:00,1403/01/13,115,SO,3,18.5,44,9.7,8.65,122.8,1.5,2024,4,0,68.00000001
12,4/1/2024 12:00,1403/01/13,115,SO,3,19,45,9.7,8.65,122,1.5,2024,4,1,1.01E-06
1,4/2/2024 1:00,1403/01/14,115,SO,3,18.5,46.5,9.65,8.65,127.8,1,2024,4,1,2.25E-22
2,4/2/2024 2:00,1403/01/14,115,SO,3,18.5,50,9.65,8.65,127.8,1,2024,4,1,5.00E-38
3,4/2/2024 3:00,1403/01/14,115,SO,3,18,50.5,9.8,8.85,127.8,1,2024,4,1,1.11E-53
4,4/2/2024 4:00,1403/01/14,115,SO,3,18,53.5,9.8,8.85,127.8,1,2024,4,1,2.46E-69
5,4/2/2024 5:00,1403/01/14,116,SO,3,17,55.5,9.8,8.85,127.8,1,2024,4,1,5.47E-85
18,4/1/2024 18:00,1403/01/13,105,SO,3,14.5,67.5,9.8,8.85,124.5,1.5,2024,4,1,1.21E-100
19,4/1/2024 19:00,1403/01/13,55,SO,3,14.5,67,9.55,8.5,125.3,1.5,2024,4,1,2.70E-116
20,4/1/2024 20:00,1403/01/13,115.5,SO,3,16.5,53,9.55,8.5,125.3,1.5,2024,4,1,5.99E-132
21,4/1/2024 21:00,1403/01/13,120.5,SO,3,17,47,9.55,8.5,124.7,2.5,2024,4,1,27.49999959
22,4/1/2024 22:00,1403/01/13,118,SO,3,19,42,9.55,8.5,124.7,2.5,2024,4,1,4.10E-07
11,4/2/2024 11:00,1403/01/14,118,SO,3,19.5,43.5,10,8.75,122.8,1.5,2024,4,1,34.99999948
12,4/2/2024 12:00,1403/01/14,125.5,SO,3,19,35.5,10,8.75,122,1.5,2024,4,2,95.99999909
1,4/3/2024 1:00,1403/01/15,125.5,LF1,3,19.5,36,10.4,9.05,127.8,1,2024,4,2,119.4999996
14,4/2/2024 14:00,1403/01/14,125.5,SO,3,19,38.5,10.4,9.05,121.1,1.5,2024,4,2,120
15,4/2/2024 15:00,1403/01/14,125.5,SO,3,18,40.5,10.3,9.05,121.1,1.5,2024,4,2,120.5
16,4/2/2024 16:00,1403/01/14,125.5,SO,3,17.5,42.5,10.3,9.05,121.1,1.5,2024,4,2,122
17,4/2/2024 17:00,1403/01/14,125.5,SO,3,17.5,46.5,10.3,9.05,123.6,1.5,2024,4,2,118.5000001
18,4/2/2024 18:00,1403/01/14,126,SO,3,16,53,10.3,9.05,124.5,1.5,2024,4,2,105.0000002
19,4/2/2024 19:00,1403/01/14,131,SO,3,15,55,10.6,9.3,125.3,1.5,2024,4,2,109.9999999
20,4/2/2024 20:00,1403/01/14,133.5,LF1,3,16,44.5,10.6,9.3,125.3,1.5,2024,4,2,121.9999998
9,4/3/2024 9:00,1403/01/15,132,LF1,3,18,34,10.6,9.3,123.6,1,2024,4,2,123
22,4/2/2024 22:00,1403/01/14,131.5,LF1,3,19,32.5,10.6,9.3,124.7,2.5,2024,4,2,121
11,4/3/2024 11:00,1403/01/15,131,LF1,3,19.5,33.5,10.65,9.25,122.8,1.5,2024,4,2,118
12,4/3/2024 12:00,1403/01/15,123.5,LF1,3,18.5,36,10.65,9.25,122,1.5,2024,4,3,117.5
13,4/3/2024 13:00,1403/01/15,124,SO,3,18,41.5,10.15,8.95,122,1.5,2024,4,3,118.5
14,4/3/2024 14:00,1403/01/15,124,SO,3,18.5,39,10.15,8.95,121.1,1.5,2024,4,3,119
15,4/3/2024 15:00,1403/01/15,124.5,SO,3,19.5,41.5,10.5,9,121.1,1.5,2024,4,3,119
16,4/3/2024 16:00,1403/01/15,126,SO,3,17,44,10.5,9,121.1,1.5,2024,4,3,119.5
17,4/3/2024 17:00,1403/01/15,126.5,SO,3,15,51.5,10.5,9,123.6,1.5,2024,4,3,119
18,4/3/2024 18:00,1403/01/15,127,SO,3,14.5,54,10.5,9,124.5,1.5,2024,4,3,114.5000001
19,4/3/2024 19:00,1403/01/15,127.5,SO,3,14.5,52.5,10.35,9.05,125.3,1.5,2024,4,3,115
8,4/4/2024 8:00,1403/01/16,125.5,SO,3,16,46,10.35,9.05,124.5,1,2024,4,3,113
21,4/3/2024 21:00,1403/01/15,125,SO,3,17.5,39,10.35,9.05,124.7,2.5,2024,4,3,113.5
22,4/3/2024 22:00,1403/01/15,126,SO,3,18,36,10.35,9.05,124.7,2.5,2024,4,3,114
11,4/4/2024 11:00,1403/01/16,125,SO,3,18.5,35.5,10,8.95,122,1.5,2024,4,3,115
12,4/4/2024 12:00,1403/01/16,123.5,SO,3,20,35.5,10,8.95,121.1,1.5,2024,4,4,115
13,4/4/2024 13:00,1403/01/16,123.5,LF1,3,19,36,10.1,8.8,121.1,1.5,2024,4,4,115
14,4/4/2024 14:00,1403/01/16,125,LF1,3,19.5,36.5,10.1,8.8,121.1,1.5,2024,4,4,115
3,4/5/2024 3:00,1403/01/17,124,SO,3,18,38.5,10.1,8.8,127.8,1,2024,4,4,115
16,4/4/2024 16:00,1403/01/16,123.5,LF1,3,18,40.5,10.1,8.8,121.1,1.5,2024,4,4,115
5,4/5/2024 5:00,1403/01/17,123.5,SO,3,17,44,10.1,8.8,127.8,1,2024,4,4,116
6,4/5/2024 6:00,1403/01/17,112.5,SO,3,15,49,10.1,8.8,127.8,1,2024,4,4,105.0000002
7,4/5/2024 7:00,1403/01/17,113,SO,3,15.5,49,9.8,8.45,127,1,2024,4,4,55.00000075
8,4/5/2024 8:00,1403/01/17,113,SO,3,17,39,9.8,8.45,124.5,1,2024,4,4,115.4999991
21,4/4/2024 21:00,1403/01/16,113,SO,3,19,34.5,9.8,8.45,122.1,2.5,2024,4,4,120.4999999
22,4/4/2024 22:00,1403/01/16,119,SO,3,19.5,36.5,9.8,8.45,123,2.5,2024,4,4,118
23,4/4/2024 23:00,1403/01/16,119,SO,3,19.5,36,10.5,8.75,123,1.5,2024,4,4,118
12,4/5/2024 12:00,1403/01/17,126,SO,3,21,27,10.5,8.75,121.1,1.5,2024,4,5,125.4999999
13,4/5/2024 13:00,1403/01/17,126,SO,3,20,27,10.9,9.15,121.1,1.5,2024,4,5,125.5
14,4/5/2024 14:00,1403/01/17,127,SO,3,19.5,31.5,10.9,9.15,121.1,1.5,2024,4,5,125.5
15,4/5/2024 15:00,1403/01/17,127.5,SO,3,19,34,10.7,9.25,121.1,1.5,2024,4,5,125.5
4,4/6/2024 4:00,1403/01/18,127,SO,3,18.5,35,10.7,9.25,127.8,1,2024,4,5,125.5
5,4/6/2024 5:00,1403/01/18,55,SO,3,18,40,10.7,9.25,127.8,1,2024,4,5,125.5
6,4/6/2024 6:00,1403/01/18,55,SO,3,16,42,10.7,9.25,127.8,1,2024,4,5,126
7,4/6/2024 7:00,1403/01/18,125,SO,3,15,49,10.85,9.35,127,1,2024,4,5,130.9999999
8,4/6/2024 8:00,1403/01/18,125,SO,3,16.5,37,10.85,9.35,124.5,1,2024,4,5,133.5
21,4/5/2024 21:00,1403/01/17,125,SO,3,20,28.5,10.85,9.35,122.1,2.5,2024,4,5,132
22,4/5/2024 22:00,1403/01/17,125.5,SO,3,20,31.5,10.85,9.35,123,2.5,2024,4,5,131.5
11,4/6/2024 11:00,1403/01/18,124.5,SO,3,21,29,10.7,9.15,122,1.5,2024,4,5,131
12,4/6/2024 12:00,1403/01/18,124,SO,3,20,29,10.7,9.15,121.1,1.5,2024,4,6,123.5000001
13,4/6/2024 13:00,1403/01/18,125,SO,3,20.5,32.5,10.75,9.1,121.1,1.5,2024,4,6,124
2,4/7/2024 2:00,1403/01/19,125,LF1,3,20.5,30.5,10.75,9.1,127,1,2024,4,6,124
15,4/6/2024 15:00,1403/01/18,124,SO,3,21,30,10.6,9.15,121.1,1.5,2024,4,6,124.5
16,4/6/2024 16:00,1403/01/18,127,SO,3,19.5,33,10.6,9.15,121.1,1.5,2024,4,6,126
17,4/6/2024 17:00,1403/01/18,128,SO,3,18.5,40,10.6,9.15,122,1.5,2024,4,6,126.5
18,4/6/2024 18:00,1403/01/18,122.5,SO,3,16,47.5,10.6,9.15,122,1.5,2024,4,6,127
19,4/6/2024 19:00,1403/01/18,123.5,SO,3,16.5,48,9.85,169.1,122.8,1.5,2024,4,6,127.5
8,4/7/2024 8:00,1403/01/19,124,LF1,3,18,39,9.85,169.1,124.5,1,2024,4,6,125.5
21,4/6/2024 21:00,1403/01/18,125,LF1,3,19,29.5,9.85,169.1,122.1,2.5,2024,4,6,125
22,4/6/2024 22:00,1403/01/18,126,LF1,3,18.5,28,9.85,169.1,123,2.5,2024,4,6,126
23,4/6/2024 23:00,1403/01/18,124.5,LF1,3,19,29,10.75,9.1,123,1.5,2024,4,6,125
24,4/7/2024 0:00,1403/01/19,125.5,LF1,3,20,45,10.75,9.1,123.8,1.5,2024,4,0,123.5
1,4/8/2024 1:00,1403/01/20,126.5,LF1,3,19.5,40,10.75,9.15,126.2,1,2024,4,0,123.5
14,4/7/2024 14:00,1403/01/19,130.5,SO,3,18,47,10.75,9.15,121.1,1.5,2024,4,0,125
15,4/7/2024 15:00,1403/01/19,115,SO,3,18,53.5,9.95,8.55,121.1,1.5,2024,4,0,124
16,4/7/2024 16:00,1403/01/19,114,SO,3,18.5,55.5,9.95,8.55,121.1,1.5,2024,4,0,123.5
5,4/8/2024 5:00,1403/01/20,117.5,LF1,3,17.5,56.5,9.95,8.55,127,1,2024,4,0,123.5
18,4/7/2024 18:00,1403/01/19,116.5,SO,3,17,58.5,9.95,8.55,122,1.5,2024,4,0,112.5000002
19,4/7/2024 19:00,1403/01/19,119.5,LF1,3,17,53,10.1,8.8,122.8,1.5,2024,4,0,113
20,4/7/2024 20:00,1403/01/19,120,LF1,3,19,48,10.1,8.8,123.6,1.5,2024,4,0,113
21,4/7/2024 21:00,1403/01/19,120.5,LF1,3,20,43.5,10.1,8.8,122.1,2.5,2024,4,0,113
22,4/7/2024 22:00,1403/01/19,119.5,LF1,3,21.5,41,10.1,8.8,123,2.5,2024,4,0,118.9999999
23,4/7/2024 23:00,1403/01/19,120,LF1,3,22,39.5,10.7,9.15,123,1.5,2024,4,0,119
12,4/8/2024 12:00,1403/01/20,125,LF1,3,23,38,10.7,9.15,118.6,1.5,2024,4,1,125.9999999
13,4/8/2024 13:00,1403/01/20,126,LF1,3,22.5,41.5,10.65,9.05,118.6,1.5,2024,4,1,126
2,4/9/2024 2:00,1403/01/21,126.5,LF1,3,22.5,43,10.65,9.05,123.7,1,2024,4,1,127
15,4/8/2024 15:00,1403/01/20,125.5,SO,3,21.5,45.5,10.65,9.05,119.5,1.5,2024,4,1,127.5
16,4/8/2024 16:00,1403/01/20,126,SO,3,21.5,45.5,10.65,9.05,120.3,1.5,2024,4,1,127
17,4/8/2024 17:00,1403/01/20,126.5,SO,3,21.5,49,10.65,9.05,121.1,1.5,2024,4,1,55.00000107
18,4/8/2024 18:00,1403/01/20,127,SO,3,21,50,10.65,9.05,122,1.5,2024,4,1,55
19,4/8/2024 19:00,1403/01/20,127.5,SO,3,20,52,10.7,9.15,122.8,1.5,2024,4,1,124.999999
20,4/8/2024 20:00,1403/01/20,128,LF1,3,20,47,10.7,9.15,123.6,1.5,2024,4,1,125
21,4/8/2024 21:00,1403/01/20,126.5,LF1,3,22,37,10.7,9.15,122.1,2.5,2024,4,1,125
10,4/9/2024 10:00,1403/01/21,125,LF1,3,22.5,39,10.7,9.15,119.5,1.5,2024,4,1,125.5
23,4/8/2024 23:00,1403/01/20,125,LF1,3,23,36.5,10.55,9.05,123,1.5,2024,4,1,124.5
12,4/9/2024 12:00,1403/01/21,124.5,LF1,3,23.5,30,10.55,9.05,118.6,1.5,2024,4,2,124
13,4/9/2024 13:00,1403/01/21,125,LF1,3,22.5,32,10.45,9.05,118.6,1.5,2024,4,2,125
14,4/9/2024 14:00,1403/01/21,125.5,LF1,3,22.5,33,10.45,9.05,118.6,1.5,2024,4,2,125
15,4/9/2024 15:00,1403/01/21,126,LF1,3,20.5,34.5,10.45,9.05,118.6,1.5,2024,4,2,124
4,4/10/2024 4:00,1403/01/22,125,LF1,3,21.5,39,10.45,9.05,125.3,1,2024,4,2,127
5,4/10/2024 5:00,1403/01/22,125.5,LF1,3,21,40,10.45,9.05,125.3,1,2024,4,2,128
6,4/10/2024 6:00,1403/01/22,127,LF1,3,19.5,44,10.45,9.05,125.3,1,2024,4,2,122.5000001
7,4/10/2024 7:00,1403/01/22,117,LF1,3,19.5,44,10.15,8.8,124.5,1,2024,4,2,123.5
8,4/10/2024 8:00,1403/01/22,117.5,LF1,3,21,37,10.15,8.8,122,1,2024,4,2,124
21,4/9/2024 21:00,1403/01/21,120,LF1,3,23.5,32.5,10.15,8.8,120.5,2.5,2024,4,2,125
22,4/9/2024 22:00,1403/01/21,118.5,LF1,3,23,29.5,10.15,8.8,121.3,2.5,2024,4,2,126
23,4/9/2024 23:00,1403/01/21,119,LF1,3,23.5,30,10.4,8.85,121.3,1.5,2024,4,2,124.5
12,4/10/2024 12:00,1403/01/22,120.5,LF1,3,24,45,10.4,8.85,118.6,1.5,2024,4,3,125.5
13,4/10/2024 13:00,1403/01/22,121,SO,3,24,44.5,10.55,8.9,118.6,1.5,2024,4,3,126.5
14,4/10/2024 14:00,1403/01/22,114.5,SO,3,23.5,44.5,10.55,8.9,118.6,1.5,2024,4,3,130.4999999
15,4/10/2024 15:00,1403/01/22,114.5,SO,3,23.5,46.5,10.35,8.9,118.6,1.5,2024,4,3,115.0000002
4,4/11/2024 4:00,1403/01/23,114.5,LF1,3,23.5,48,10.35,8.9,125.3,1,2024,4,3,114
17,4/10/2024 17:00,1403/01/22,114.5,SO,3,22,55,10.35,8.9,119.5,1.5,2024,4,3,117.4999999
18,4/10/2024 18:00,1403/01/22,114.5,SO,3,21.5,56,10.35,8.9,120.3,1.5,2024,4,3,116.5
19,4/10/2024 19:00,1403/01/22,114.5,SO,3,20.5,56.5,10.15,8.8,121.1,1.5,2024,4,3,119.5
8,4/11/2024 8:00,1403/01/23,120.5,LF1,3,21,53.5,10.15,8.8,122,1,2024,4,3,120
21,4/10/2024 21:00,1403/01/22,121,LF1,3,21.5,51,10.15,8.8,120.5,2.5,2024,4,3,120.5
22,4/10/2024 22:00,1403/01/22,120,LF1,3,22.5,48.5,10.15,8.8,121.3,2.5,2024,4,3,119.5
23,4/10/2024 23:00,1403/01/22,119,LF1,3,23.5,43,10.75,9.1,121.3,1.5,2024,4,3,120
24,4/11/2024 0:00,1403/01/23,126.5,LF1,3,21,32,10.75,9.1,121.3,1.5,2024,4,4,124.9999999
1,4/12/2024 1:00,1403/01/24,126.5,LF1,3,21.5,32,10.8,9.15,123.6,1,2024,4,4,126
14,4/11/2024 14:00,1403/01/23,128,LF1,3,21,33,10.8,9.15,118.6,1.5,2024,4,4,126.5
15,4/11/2024 15:00,1403/01/23,128.5,LF1,3,20,37.5,10.75,9.2,118.6,1.5,2024,4,4,125.5
16,4/11/2024 16:00,1403/01/23,128.5,LF1,3,18.5,42.5,10.75,9.2,118.6,1.5,2024,4,4,126
17,4/11/2024 17:00,1403/01/23,129,LF1,3,17.5,46.5,10.75,9.2,119.5,1.5,2024,4,4,126.5
18,4/11/2024 18:00,1403/01/23,129.5,LF1,3,16.5,50,10.75,9.2,120.3,1.5,2024,4,4,127
19,4/11/2024 19:00,1403/01/23,129,LF1,3,17,48,10.8,9.2,121.1,1.5,2024,4,4,127.5
8,4/12/2024 8:00,1403/01/24,129,LF1,3,18,37.5,10.8,9.2,122,1,2024,4,4,128
21,4/11/2024 21:00,1403/01/23,127.5,LF1,3,19,32.5,10.8,9.2,120.5,2.5,2024,4,4,126.5
22,4/11/2024 22:00,1403/01/23,127,LF1,3,20.5,29.5,10.8,9.2,121.3,2.5,2024,4,4,125
23,4/11/2024 23:00,1403/01/23,128,LF1,3,20,35,10.55,9.15,121.3,1.5,2024,4,4,125
12,4/12/2024 12:00,1403/01/24,128,LF1,3,20,26,10.55,9.15,118.6,1.5,2024,4,5,124.5
1,4/13/2024 1:00,1403/01/25,129,LF1,3,19,29.5,10.4,9.15,123.6,1,2024,4,5,125
14,4/12/2024 14:00,1403/01/24,129.5,LF1,3,18.5,31.5,10.4,9.15,118.6,1.5,2024,4,5,125.5
15,4/12/2024 15:00,1403/01/24,119.5,LF1,3,18.5,35,10.4,8.95,118.6,1.5,2024,4,5,126
16,4/12/2024 16:00,1403/01/24,122,LF1,3,18.5,35,10.4,8.95,118.6,1.5,2024,4,5,125
5,4/13/2024 5:00,1403/01/25,123,LF1,3,17,38,10.4,8.95,125.3,1,2024,4,5,125.5
6,4/13/2024 6:00,1403/01/25,121.5,LF1,3,16,44.5,10.4,8.95,125.3,1,2024,4,5,127
7,4/13/2024 7:00,1403/01/25,121.5,LF1,3,17.5,41,10.3,8.85,124.5,1,2024,4,5,117.0000001
8,4/13/2024 8:00,1403/01/25,122.5,LF1,3,17.5,35.5,10.3,8.85,122,1,2024,4,5,117.5
21,4/12/2024 21:00,1403/01/24,123,LF1,3,18,31.5,10.3,8.85,120.5,2.5,2024,4,5,120
10,4/13/2024 10:00,1403/01/25,122.5,LF1,3,18,31.5,10.3,8.85,119.5,1.5,2024,4,5,118.5
23,4/12/2024 23:00,1403/01/24,129.5,LF1,3,18,30.5,10.85,9.15,121.3,1.5,2024,4,5,119
24,4/13/2024 0:00,1403/01/25,123.5,SO,3,19,34.5,10.85,9.15,121.3,1.5,2024,4,6,120.5
1,4/14/2024 1:00,1403/01/26,123,SO,3,17.5,35,10.55,8.9,123.6,1,2024,4,6,121
2,4/14/2024 2:00,1403/01/26,123,SO,3,18.5,34.5,10.55,8.9,123.6,1,2024,4,6,114.5000001
3,4/14/2024 3:00,1403/01/26,122.5,SO,3,18.5,37.5,10.3,8.9,124.5,1,2024,4,6,114.5
4,4/14/2024 4:00,1403/01/26,120,SO,3,17.5,40,10.3,8.9,125.3,1,2024,4,6,114.5
5,4/14/2024 5:00,1403/01/26,121,SO,3,17,41.5,10.3,8.9,125.3,1,2024,4,6,114.5
6,4/14/2024 6:00,1403/01/26,121,SO,3,15.5,44.5,10.3,8.9,125.3,1,2024,4,6,114.5
7,4/14/2024 7:00,1403/01/26,121,SO,3,17,48,10.4,8.95,124.5,1,2024,4,6,114.5
8,4/14/2024 8:00,1403/01/26,121,SO,3,18,40,10.4,8.95,122,1,2024,4,6,120.4999999
21,4/13/2024 21:00,1403/01/25,121,SO,3,18.5,37,10.4,8.95,120.5,2.5,2024,4,6,121
22,4/13/2024 22:00,1403/01/25,120,SO,3,18.5,34.5,10.4,8.95,121.3,2.5,2024,4,6,120
11,4/14/2024 11:00,1403/01/26,120,SO,3,19.5,36,10.45,8.95,118.6,1.5,2024,4,6,119
24,4/14/2024 0:00,1403/01/26,122,LF1,3,19,31,10.45,8.95,121.3,1.5,2024,4,0,126.4999999
